id,site,job_url,title,company,location,date_posted,job_type,salary_source,interval,min_amount,max_amount,currency,is_remote,job_level,job_function,listing_type,description,company_industry,company_url,company_num_employees,company_revenue,company_description,skills,experience_range,company_rating,company_reviews_count,state,parsed_skills
in-59678ab9ca69963e,indeed,https://www.indeed.com/viewjob?jk=59678ab9ca69963e,Academic Records Systems Analyst,Loyola Marymount University,"Los Angeles, CA, US",2025-11-12,fulltime,direct_data,yearly,71100.0,88900.0,USD,False,,,,"The Academic Records Systems Analyst is a vital member of the Office of the Registrar, responsible for ensuring the accuracy, efficiency, and reliability of the Student Information System (SIS). This role focuses on three core functions: maintaining and testing academic records systems, developing reports, and ensuring institutional and regulatory compliance. The ideal candidate is detail-oriented, systems-savvy, and committed to meeting operational deadlines with precision and professionalism. Position Specific Responsibilities/Accountabilities Systems Maintenance & Testing Perform regular system maintenance, upgrades, and quality assurance testing of SIS (e.g., Banner or similar platform). Collaborate with IT and functional stakeholders to implement and test new SIS features, patches, or integrations. Troubleshoot system issues and support resolution efforts to minimize disruption to academic processes. Reporting & Data Analysis Design, generate, and maintain reports and queries to support academic operations, compliance, and decision-making. Work closely with institutional research, IT, and other departments to ensure accurate and timely data reporting. Provide data extracts for audits, surveys, and internal/external reporting needs. Compliance & Policy Support Ensure academic records systems are in alignment with institutional policies, FERPA regulations, the National Student Clearinghouse and accreditation requirements. Monitor and document system configurations, workflows, and changes to ensure data integrity and compliance. Responsible for reporting and error resolution to the NSC. Support audits and internal reviews by preparing documentation and responding to inquiries. Loyola Marymount University Expectations Exhibit behavior that supports the mission, vision, and values of the university. Communicate and employ interpersonal actions that model high standards of professional, responsible, accountable, and ethical conduct. Demonstrate a commitment to outstanding customer service. Requisite Qualifications Typically a Bachelor's Degree or equivalent combination of education and experience. Incumbent will be expected to continue upgrading knowledge, skills, and abilities needed to keep abreast of regulation/policy changes. Minimum 3 years of relevant experience in the areas of registrar/academic records/student systems preferably in an academic community. Experience with Banner, Slate, Database management, Argos/Evisions and Workflows is preferred. Demonstrated knowledge in the areas of: SQL and MS Access reporting tools, modern office practices and procedures; operation of various office machines; filing systems; proofreading; correct use of English, spelling, grammar; mathematical computations. Organizational skills and accuracy in recording tasks are essential. With minimal supervision, perform academic record functions involving independent judgment and requiring accuracy. Stay informed on academic policies and regulations, as well as changes in office procedures. Use good judgment in interpreting the rules, regulations, procedures, and policies of the University (which vary with each college) for the students and faculty, referring exceptions to the proper person for appropriate action. Maintain confidence and confidential information. Exemplary communication skills (both written and oral). Work effectively with all levels of the University organization, maintaining a friendly, courteous, fair, and yet firm disposition. Proactive, self-starter Demonstrated computer competency and preferably knowledgeable of Microsoft Office suite and student information systems (i.e. Ellucian Banner). The above statements are intended to describe the general nature and level of work being performed. They are not intended to be construed as an exhaustive list of all responsibilities, duties and skills required of this position. #HERC# #HEJ# Staff Regular Salary range $71,100.00 - $88,900.00 Salary commensurate with education and experience. Please note that this position is not eligible for visa sponsorship now or in the future. Loyola Marymount University, a Carnegie classified R2 institution in the mainstream of American Catholic higher education, seeks outstanding applicants who value its mission and share its commitment to inclusive excellence, the education of the whole person, and the building of a just society. LMU is an equal opportunity employer committed to providing an environment free from discrimination and harassment as defined by federal, state and local law. We invite all persons in the full diversity of their being, life experience, and beliefs to apply. (Visit www.lmu.edu for more information.)",Education And Schools,https://www.indeed.com/cmp/Loyola-Marymount-University,"1,001 to 5,000",$100M to $500M (USD),,,,,,California,"communication, sql"
in-5ff06a95c18c731d,indeed,https://www.indeed.com/viewjob?jk=5ff06a95c18c731d,Data and Database Engineering Manager,"University of California, Riverside","Riverside, CA, US",2025-11-12,fulltime,direct_data,yearly,103100.0,196300.0,USD,True,,,,"The Data & Database Engineering Manager leads a critical team within the Office of Data & Analytics, serving as the cornerstone of our data-informed campus. The team is dedicated to building and maintaining a scalable and reliable data infrastructure to drive innovation and informed decision-making. This scope encompasses treating data as a product, working closely with Data Stewards and the Analytics team to ensure trusted, high-quality data is available in a self-service format for the entire campus. A key focus is designing this data infrastructure to optimally support advanced AI systems, enabling both traditional data science and emerging Generative AI use cases. Additionally, the team is responsible for the vital administration, maintenance, performance, and uptime of the underlying relational databases that power essential campus operations. This position is classified as predominantly remote with occasional visits to campus as needed. Working hours will be based on Pacific Standard Time (PST). The full salary range for the Data Systems Manager is $103,100 - $196,300 annually. However, the pay scale for this position is up to $146,232 annually. We base salary offers on a variety of considerations, such as education, licensure and certifications, experience, and other business and organizational needs. Applicants must have current work authorization when accepting a UCR staff position. Currently, UCR is unable to sponsor or take over sponsorship of an employment Visa for staff. As a University employee, you will be required to comply with all applicable University policies and/or collective bargaining agreements, as may be amended from time to time. Federal, state, or local government directives may impose additional requirements. degree Bachelor's degree in related area and/or equivalent experience/training. Required experience 6 - 10 years of related experience. Required Must pass a background check. required Required Requires critical thinking, persuasion/negotiation, mentoring, leadership/management, problem solving, human resources policies and procedures relating to management responsibilities, verbal and written communication, quantitative abilities, analytical, strong technical database systems skills. Must have knowledge of location and system protocols and procedures for budget and account management. Excellent oral and written communication skills. Knowledge of data management systems, practices and standards. Knowledge of relevant rules and regulations. Requires knowledge of database management systems. Demonstrated skill in managing technical staff. Knowledge of scripting languages like Python and experience with orchestration tools (e.g., Apache Airflow). Strong proficiency in SQL and experience with a variety of relational and non-relational databases. Knowledge of data management systems, practices and standards. Required",Education And Schools,"https://www.indeed.com/cmp/University-of-California,-Riverside","1,001 to 5,000",$100M to $500M (USD),,,,,,California,"airflow, communication, leadership, python, sql"
in-be6e2346d45f4e7b,indeed,https://www.indeed.com/viewjob?jk=be6e2346d45f4e7b,Database Administrator,Cumming Group,"Murrieta, CA, US",2025-11-12,fulltime,direct_data,yearly,91000.0,121333.0,USD,False,,,,"At Cumming Group, you will work on some of the world's most exciting projects in a dynamic environment where your success is measured by the impact you make. We are one of the fastest-growing project and cost management consultancies in the United States, as reflected in our top 10 rankings in ENR. With over 60 offices globally, an extremely diverse project portfolio, and double-digit year-over-year revenue growth, the opportunities to make your mark are limitless! We're seeking an experienced Database Administrator to join our internal IT team, based onsite at our Murrieta, CA or Columbia, SC office. The Database Administrator is responsible for the performance, reliability, and security of the company's database systems, with a primary focus on administering and optimizing the Deltek Vantagepoint ERP backend. This role manages multiple Microsoft SQL Server environments, on-premise and cloud-connected, ensuring data integrity, availability, and alignment with business needs. The ideal candidate is a hands-on technical specialist who thrives on maintaining mission-critical systems while contributing to broader modernization efforts across the company's technology ecosystem. Essential Duties & Responsibilities: SQL Server & ERP Administration Administer, monitor, and maintain multiple Microsoft SQL Server instances, with the Deltek Vantagepoint ERP database as the primary system of record. Write, optimize, and tune complex T-SQL queries, stored procedures, and views for both ad hoc analysis and application logic. Create and schedule SQL Server Agent jobs to automate data ingestion, maintenance routines, and reporting pipelines. Implement, document, and test backup and disaster recovery strategies to ensure business continuity. Manage database indexes, performance tuning, and query optimization to support application efficiency and stability. Plan and execute Deltek Vantagepoint upgrades, schema updates, and integrations, working closely with the ERP administrator and IT team. Design and publish SSRS reports and datasets to meet business and finance reporting requirements. Cross-System Data Architecture Support integration between SQL Server and the Azure Databricks Lakehouse, ensuring consistent and secure data flow. Collaborate with data engineers and analysts to maintain data integrations to other critical systems. Develop and maintain SQL transformations and stored procedures that serve as upstream logic for analytics and reporting layers. Contribute to the management of Unity Catalog, metadata inventory, and data lineage documentation. Partner with Power BI administrators to optimize Fabric dataset refreshes, gateways, and source connections. Data Governance, Security, & Monitoring Enforce data security and access controls aligned with IT and Data Governance policies. Participate in data issue management and quality improvement processes, ensuring system reliability and integrity. Monitor system performance using both native and custom monitoring tools; proactively identify and resolve issues. Maintain clear, comprehensive documentation for database configurations, schemas, and operational procedures. Knowledge & Skills Required: Strong proficiency in SQL Server administration, including configuration, optimization, and security management. Expert-level T-SQL skills (CTEs, window functions, MERGE statements, temp tables, and dynamic SQL). Demonstrated experience managing ERP databases, preferably Deltek Vantagepoint or similar enterprise systems. Experience with on-premise SQL Server environments. Knowledge of data warehouse concepts. Familiarity with Azure Databricks and Power BI data connectivity preferred. Working understanding of data governance principles (metadata, lineage, access, and data quality). Scripting experience in PowerShell a plus Strong communication and documentation skills with an ability to translate technical issues to business impact. Detail-oriented, analytical, and able to manage multiple priorities in a fast-paced environment. Preferred Education and Experience: Education: Bachelor's degree in Computer Science, Information Systems, or a related technical discipline. Experience: Minimum 3&ndash;7 years of hands-on SQL Server database administration experience. Experience supporting Deltek Vision/Vantagepoint or similar ERP systems strongly preferred. Experience with Databricks a plus. #LI-SJ1 Cumming Group is committed to providing Equal Employment Opportunity in its personnel policies and practices. It is Cumming Group's policy to recruit, hire, train and promote Team Members and applicants for employment without regard to race, color, creed, religion, age, sex, marital status, registered domestic partner status, genetic information, sexual preference, sexual orientation, gender (including gender expression and gender identity), pregnancy (including childbirth or related medical conditions, including breastfeeding), military service, national origin, ancestry, citizenship, physical disability, mental disability, veteran status or any other protected classification under federal, state, or local law. All such decisions are based on (1) individual merit, qualifications, and competence as they relate to the particular position, and (2) promotion of the principle of equal employment opportunity. All other terms and conditions of employment, such as compensation, benefits, transfers, layoff, return from layoff, training, education, and social and recreational programs, are administered without regard to the characteristics described above. To this end, Cumming Group complies with all provisions of Title VII of the Civil Rights Act of 1964 as amended, all of the rules, regulations and relevant orders of the Secretary of Labor, and all similar state and local laws. The salary range for this full-time role is $91,000.00-$121,333.35 per year. Ranges are determined based on the position, geography, client and industry experience and level, and represent a good faith effort to provide a fair and equitable salary. This range reflects base salary only, and not the total compensation package. Cumming Group reserves the right to pay more or less than the posted range, depending on a candidate's experience, skills, and qualifications, including client requirements. In addition to base salary, Cumming Group offers a comprehensive benefits package including: Medical Dental Insurance Vision Insurance 401(k) 401(k) Matching Paid Time Off Paid Holidays Short and long-term disability Employee Assistance Program",nan,https://www.indeed.com/cmp/Cumming-Group-1,"1,001 to 5,000",$100M to $500M (USD),Cumming Group's exceptional management skills have led to us becoming one of the most successful project management and cost consulting firms in our industry.,,,,,California,"azure, classification, communication, databricks, lakehouse, power bi, powershell, sql"
in-d3c682c71d35d4a3,indeed,https://www.indeed.com/viewjob?jk=d3c682c71d35d4a3,Oracle Database Administrator,Caldera Medical,"Westlake Village, CA, US",2025-11-12,fulltime,direct_data,yearly,135000.0,150000.0,USD,False,,,,"Position Title and Location Caldera Medical's Mission - To Improve the Quality of Life for Women! Message from the Hiring Manager: Caldera Medical is seeking an Oracle Database Administrator to support our Oracle Fusion ERP. The role will be responsible for maintenance activities, user access, ticket support, training, and project oversight. This role will be the primary liaison with the company's 3rd Managed Service Provider. The role may include limited responsibilities with other systems such as Sales Force. Duties and Responsibilities: Provide technical support for Oracle Fusion and limited activities on other systems such as Sales Force Assist with new user set up, monitor user access to ensure compliance with contracted licenses Review all new system tickets to determine priority, provide technical support to solve basic tickets to reduce 3rd Party Managed Service Providers hours Act as internal project manager for system implementations and enhancements Provide end user training Develop and maintain system documentation, policies, and training materials Act as the primary Company liaison with 3rd Party Managed Service Provider to ensure proper support is being delivered, including ticket prioritization, timely resolution and other system monitoring activities Recommend system improvements (e.g., new reporting, functionality, automation) Required Knowledge, Skills and Abilities: Bachelor's degree in computer science, IT, or Information Systems or a related field 3+ years' experience as Database / System Administrator with Oracle Fusion Oracle Certified Database Administrator Certificate Proficient with Oracle Fusion Experience managing user access, roles, and permissions within enterprise systems. Strong problem-solving and troubleshooting abilities, management, detail orientation, and analytical skill Excellent written and verbal communication skills, with the ability to explain technical concepts to non-technical users. Project Management experience with system enhancements and implementations. Competitive Compensation, Comprehensive Benefits, and more! $135k - $150k Annual Salary Medical and Dental Benefits &ndash; 75% paid for employee and family members Vision Coverage 401(k) with 4% matching contributions after 90 days of employment Basic Life and AD&D Unlimited Vacation Policy 6 Weeks Paid Maternity Leave 10 paid holidays Being surrounded by amazing people! (This role is being filled directly by our in-house recruiting team. We are not working with outside agencies for this position.) Our Culture- Where Career and Passion come together! A Culture of family and team&hellip; not a corporate goliath where you're just another number. All employees get a seat at the table and have influence with management. We care about giving back to the community. Our team donates time to helping local charities throughout Southern California. The Women's Health Initiative is the heart of what we do, every day we put underprivileged women first. Our goal is to treat 1 million women suffering from incontinence by 2027! Who is Caldera Medical? Caldera Medical is a growth stage medical device company dedicated to improving the quality of life for women. In 2018, Caldera was ranked one of Inc 5000's fastest growing private companies in the United States and was ranked #38 fastest growing private company and #3 fastest growing Healthcare Company in Los Angeles by the LA Business Journal. We develop and market differentiated surgical implants specifically for the treatment of Stress Urinary Incontinence and Pelvic Organ Prolapse. Our products are used by Urogynecologists, Gynecologists, and Urologists worldwide. Caldera Medical is an equal opportunity employer and considers all candidates for employment regardless of race, color, religion, sex, national origin, citizenship, age, disability, marital status, military or veteran's status (including protected veterans, as may be required by federal law), sexual orientation, gender identity or any other category protected by law.",nan,https://www.indeed.com/cmp/Caldera-Medical,51 to 200,$5M to $25M (USD),,,,,,California,"communication, oracle, project management"
