id,site,job_url,title,company,location,date_posted,job_type,salary_source,interval,min_amount,max_amount,currency,is_remote,job_level,job_function,listing_type,description,company_industry,company_url,company_num_employees,company_revenue,company_description,skills,experience_range,company_rating,company_reviews_count,state,parsed_skills
in-bfe3f889e0f82e20,indeed,https://www.indeed.com/viewjob?jk=bfe3f889e0f82e20,Cassandra Admin L3,Tata Consultancy Services (TCS),"San Jose, CA, US",2025-11-27,nan,direct_data,yearly,64000.0,140000.0,USD,False,,,,"Must Have Technical/Functional Skills Hands-on exposure with DataStax and Apache Cassandra as primary Redis Stack as secondary skill. Hands-on exposure with Linux-based on-prem database administration with experience in Cluster Installation, Upgrades, Scaling up nodes/data centers. Exposure to Graph and Spark workloads, OpsCenter UIs. Good exposure with backup, restore, repair, data replication, and compaction strategies. Ability to troubleshoot and resolve performance issues. Good to have exposure to Kubernetes based database administration. Salary Range: $64,000-$140,000 a year #LI-CM2 Location San Jose, CA Job Function TECHNOLOGY Role Engineer Job Id 383474 Desired Skills Cassandra | Linux | Spark Salary Range $64,000-$140,000 a year",Consulting And Business Services,https://www.indeed.com/cmp/Tata-Consultancy-Services-(tcs),"10,000+",more than $10B (USD),"Tata Consultancy Services is an IT services, consulting and business solutions organization that delivers real results to global business.",,,,,California,"cassandra, kubernetes, linux, redis, spark"
in-c6613a677f2c0eaf,indeed,https://www.indeed.com/viewjob?jk=c6613a677f2c0eaf,Membership/Database Specialist,nan,"Los Angeles, CA, US",2025-11-26,parttime,nan,nan,,,nan,False,,,,"The Membership/Database Specialist is an integral part of a team-oriented and results driven area of the Al Wooten Jr. Youth Center. The position is responsible for the accurate inputting of member information and the tracking of the programs and outcomes that the students participate in. The specialist is responsible for supporting and performing the organization's membership database functions utilizing Kid Trax membership program and utilizing the Apricot system to adhere to data entry and tracing of outcomes and participation of students. To successfully fulfill this role, the Specialist should be highly detailed orientated with a critical degree of accuracy regarding data entry. The role also requires heavy computer and office-based responsibilities. HOURS: Mon-Fri. 1pm-5pm. Some Saturdays may be required with notice RESPONSIBILITIES Support the organization's strategic use of data to further the goals and processing of the membership objectives. Collaborate with program staff to ensure that all data relating to the programs and activities that youth are participating in are captured in membership and database programs Ensure that data that is being inputted is accurate Provide reports to directors and other staff when instructed to. Information should be able to be explained with appropriate details Act as an internal trainer with membership and database systems in tools when necessary Assess and update database documentation processes and procedures when necessary Invite and build upon the ideas and input of others Communicate with parents and assist them in the using of the membership system when necessary Establish proper policies and procedures are put in place that allows trouble shooting when membership and database systems are not functioning properly When instructed, attend community and agency events to promote the Al Wooten Jr Youth Center and the programs and activities that are provided to the youth and their families Supports basic office duties and responsibilities including answering office phone calls and customer service functions QUALIFICATIONS 1-3 years of related experience or equivalent combination of education and experience. Bachelor's degree preferred 1-3 years of applicable database experience required; hands on experience with membership base and or database programs preferred Exceptional organizational, analytical and problem-solving skills Excellent interpersonal and customer relations skills, including the ability to provide technical support to others of all levels and backgrounds High level of discretion, professionalism and confidentiality required Demonstrated ability to work both as a team member and independently with minimal supervision in a time sensitive environment Proficiency in utilizing Microsoft Office 365 and Google platform utilities Excellent oral and written communication skills with the ability to deliver clear and effective messages to all staff members, students and their families DISCLAIMER The information presented indicates the general nature of work and the expected level of work of employees in this classification. It is not designed to contain, nor to be interpreted as, a comprehensive inventory of all duties, responsibilities, qualifications and objectives required of employees assigned to this job. Al Wooten Jr. Youth Center is an Equal Opportunity Employer and does not discriminate on the basis of race, color, religion, national origin, gender identity, sexual orientation, pregnancy, disability, political affiliation, marital or family status, age, military service, or other non-merit factors.",nan,nan,nan,nan,,,,,,California,"classification, communication"
in-256bd52f3ab5d380,indeed,https://www.indeed.com/viewjob?jk=256bd52f3ab5d380,Systems Database Administrator,Santa Clara Family Health Plan,"San Jose, CA, US",2025-11-25,fulltime,direct_data,yearly,111168.0,172310.0,USD,False,,,,"Salary Range: $111,168 - $172,310 The expected pay range is based on many factors, such as experience, education, and the market. The range is subject to change. FLSA Status: Exempt Department: Information Technology Reports To: Director, Infrastructure and Systems Support Employee Unit: Employees in this classification are represented by Service Employees International Union (SEIU) Local No. 521 GENERAL DESCRIPTION OF POSITION The Systems Database Administrator is responsible for database security, integrity, performance, availability, and recoverability of databases, database servers, and related systems. In addition, the Systems Database Administrator is responsible for installing, configuring, and maintaining database servers, databases, related objects, and related software and for database security in support of SCFHP objectives and regulatory compliance. ESSENTIAL DUTIES AND RESPONSIBILITIES To perform this job successfully, an individual must be able to perform each essential duty listed below satisfactorily. Provide technical management and support for the organization's database environments to ensure database security, integrity, performance, availability and recoverability of databases, database servers, and related systems. Develop, implement, and periodically test backup and recovery plan for the production of critical databases to ensure the business continuity plan is accurate and effective. Ensure database security by controlling access to databases through authentication and authorization and performing auditing of database usage and active users. Audit database security and user access to ensure HIPPA regulatory law reporting requirements are met. Monitor database server resources to ensure production environments meet performance and availability requirements. Install, test, secure and maintain new versions of database software, patches and other associated software application changes or upgrades. Provide storage and capacity planning, long and short term, to ensure adequate space is available for all database environments. Document database architecture, including developing and maintaining database installation and configuration procedures, data governance program, change control deployment procedures, and SQL coding guidelines. Work with the application development team to ensure that appropriate and efficient SQL is coded and tested prior to production deployment. Perform other related duties as required or assigned. REQUIREMENTS &ndash; Required (R) Desired (D) The requirements listed below are representative of the knowledge, skill, and/or ability required or desired. Bachelor's Degree in Computer Science, or related field, or equivalent experience, training or coursework. (R) Minimum three years of experience serving as a systems database administrator in a Microsoft SQL Server environment with versions currently supported by Microsoft. (R) Microsoft Certified Solutions Expert (MCSE). (D) Minimum three years of experience maintaining multiple database environments and regions to support production, development and test areas of business systems; including managing database security, database tuning, query optimization, and application code deployment. (R) Minimum three years of experience SQL Scripting and Command Shell scripting. (R) Minimum three years of experience with any of the following applicable languages/platforms: .NET, PERL, Java, SAS, VB, C++, or other modern programming language or related software. (R) Minimum three years of experience with MS SQL Business Intelligence tools (SSRS, SSIS, SSAS) or other enterprise business intelligence software. (R) Experience maintaining a data warehouse database environment, including managing and enforcing data governance and coding best practice. (R) Ability to create and maintain documentation of source code, application installation processes, technical specifications, and data governance program. (R) Working knowledge of and the ability to efficiently operate all applicable computer software including computer applications such as Outlook, Word and Excel. (R) Ability to use a keyboard with moderate speed and a high level of accuracy. (R) Excellent communication skills including the ability to express oneself clearly and concisely when providing service to SCFHP internal departments, providers and outside entities over the telephone, in person or in writing. (R) Ability to think and work effectively under pressure and accurately prioritize and complete tasks within established timeframes. (R) Ability to assume responsibility and exercise good judgment when making decisions within the scope of the position. (R) Ability to maintain confidentiality. (R) Ability to comply with SCFHP's policies and procedures. (R) Ability to perform the job safely with respect to others, to property, and to individual safety. (R) WORKING CONDITIONS Generally, duties are primarily performed in an office environment while sitting or standing at a desk. Incumbents are subject to frequent contact with and interruptions by co-workers, supervisors, and plan members or providers in person, by telephone, and by work-related electronic communications. PHYSICAL REQUIREMENTS Incumbents must be able to perform the essential functions of this job, with or without reasonable accommodation: Mobility Requirements: regular bending at the waist, and reaching overhead, above the shoulders and horizontally, to retrieve and store files and supplies and sit or stand for extended periods of time; (R) Lifting Requirements: regularly lift and carry files, notebooks, and office supplies that may weigh up to 5 pounds; (R) Visual Requirements: ability to read information in printed materials and on a computer screen; perform close-up work; clarity of vision is required at 20 inches or less; (R) Dexterity Requirements: regular use of hands, wrists, and finger movements; ability to perform repetitive motion (keyboard); writing (note-taking); ability to operate a computer keyboard and other office equipment (R) Hearing/Talking Requirements: ability to hear normal speech, hear and talk to exchange information in person and on telephone; (R) Reasoning Requirements: ability to think and work effectively under pressure; ability to effectively serve customers; decision making, maintain a concentrated level of attention to information communicated in person and by telephone throughout a typical workday; attention to detail. (R) ENVIRONMENTAL CONDITIONS General office conditions. May be exposed to moderate noise levels. EOE",nan,https://www.indeed.com/cmp/Santa-Clara-Family-Health-Plan,201 to 500,$1B to $5B (USD),"Santa Clara Family Health Plan (SCFHP) is a local, public, not-for-profit health plan dedicated to improving the health and well-being of the residents of Santa Clara County.",,,,,California,"c++, classification, communication, excel, java, r, sas, shell scripting, sql"
in-fd157b42bc1bdb23,indeed,https://www.indeed.com/viewjob?jk=fd157b42bc1bdb23,INFORMATION TECHNOLOGY ANALYST II/III/IV - DATABASE ADMINISTRATOR,Fresno County,"CA, US",2025-11-24,fulltime,direct_data,yearly,57044.0,102388.0,USD,True,,,,"Position Description Annual Salaries Information Technology Analyst II: $57,044.00 - $72,800.00 Information Technology Analyst III: $67,288.00 - $85,878.00 Information Technology Analyst IV: $80,210.00 - $102,388.00 The County of Fresno invites applications for the position of Information Technology Analyst II/III/IV - Database Administrator . The incumbent extracts, loads, and manages organizational data; designs, develops, and maintains enterprise-level database systems; ensures database hardware and software are current; implements and ensures compliance with enterprise data integrity standards; monitors and optimizes database performance; performs backup and recovery; develops and maintains database workflows and tools; and performs related work as required HYBRID TELEWORK AVAILABILITY (Remote Work Options) &ndash; Some departments may offer hybrid telework opportunities, depending on departmental directives. Currently, the Information Technology Services Department offers hybrid telework options that require at least two in-office days per week. All schedules are subject to manager or supervisor approval. Candidates invited to interview for open positions may confirm the availability of hybrid telework opportunities and discuss details with the hiring department. Please note: The current vacancies exist within the Information Technology Services Department. However, the eligible list established from this recruitment may be used to fill vacancies in other County departments as they occur. Fresno County is working together for a quality of life for all. Our mission is to provide excellent public services to our diverse community. Samples of Duties Extracts, loads, and manages organizational data; Designs, develops, and maintains enterprise-level database systems; Ensures database hardware and software are current; Implements and ensures compliance with enterprise data integrity standards; Monitors and optimizes database performance; Performs backup and recovery; Develops and maintains database workflows and tools Knowledge, Skills and Abilities Knowledge of: Technical and operational aspects of administrering enterprise-level SQL Server and MySQL databases; SQL Server Management Studio (SSMS); Database performance monitoring and reporting tools; Configuring and managing parameters to ensure fast and efficient database query responses. Skills/Abilities to: Design, install, and implement databases to meet end-user and organizational requirements; Use transaction recovery techniques and perform database backups; Apply effective problem-solving and troubleshooting skills to resolve outages and performance issues; Demonstrate strong attention to detail; Document and maintain processes and procedures ensuring database security, availability, and integrity; Manage multiple work assignments, set priorities, and meet established deadlines effectively and independently; Communicate and present technical information clearly, both orally and in writing, to technical and non-technical audiences; Establish and maintain effective working relationships across all organizational levels, with partner agencies, and with the public. Minimum Qualifications Please Note: This recruitment has been limited to candidates possessing a specific experience background related to the specific position vacancy. Information Technology Analyst II Option 1: Experience: Three (3) years of full-time, paid work experience developing, administering, or maintaining enterprise-level databases. Substitution: Possession of a valid certification from Microsoft in database administration obtained or renewed within the last five (5) years, may substitute for one (1) year of the required experience. Option 2 : Education: Completion of sixty (60) semester units of coursework that is acceptable within the United States' accredited college or university system with at least fifteen (15) units of coursework in Information Systems, Computer Science, or a closely related field. and Experience: One (1) year of full-time, paid work experience developing, administering, or maintaining enterprise-level databases. Information Technology Analyst III Option 1: Experience: Four (4) years of full-time, paid work experience developing, administering, or maintaining enterprise-level databases. Substitution: Possession of a valid certification from Microsoft in database administration obtained or renewed within the last five (5) years, may substitute for one (1) year of the required experience. Option 2 : Education: Completion of sixty (60) semester units of coursework that is acceptable within the United States' accredited college or university system with at least fifteen (15) units of coursework in Information Systems, Computer Science, or a closely related field. and Experience: Two (2) year of full-time, paid work experience developing, administering, or maintaining enterprise-level databases. Information Technology Analyst IV Option 1: Experience: Five (5) years of full-time, paid work experience developing, administering, or maintaining enterprise-level databases. Substitution: Possession of a valid certification from Microsoft in database administration obtained or renewed within the last five (5) years, may substitute for one (1) year of the required experience. Option 2 : Education: Completion of sixty (60) semester units of coursework that is acceptable within the United States' accredited college or university system with at least fifteen (15) units of coursework in Information Systems, Computer Science, or a closely related field. and Experience: Three (3) year of full-time, paid work experience developing, administering, or maintaining enterprise-level databases. In addition to the options listed above, the following may also be required: License: Possession of a valid Class ""C"" driver's license, or equivalent, may be required. Please Note: As a condition of employment, some departments may require candidates to undergo and pass a background investigation and/or polygraph examination. These investigations include employment/credit histories, verification of education, arrest/criminal records, drug/alcohol use, and personal conduct. This list is neither inclusive nor exclusive; other relevant areas may be investigated and verified. HOW TO APPLY Applicants must be submitted online only . An online application can be found at FresnoCountyJobs.com . Open the Job Information Flyer to begin the online application process. Once the filing deadline has passed, you may check the status of this recruitment by logging on to: https://www.governmentjobs.com/Applications/Index/fresnoca . Please Note: It is the applicant's responsibility to notify Human Resources of any email address, mailing address and telephone number changes. Notices from Human Resources will be sent via email only. REQUIRED APPLICATION MATERIALS A complete, accurate Fresno County employment application must be submitted online only and shall include: All education and work experience to demonstrate the applicant meets the minimum qualifications. A copy of your transcripts that verify possession of the required education, if applicable; unofficial transcripts are acceptable. If education was completed outside the United States' accredited college or university system, documentation that the education is comparable to that received within the United States' system must be provided by the closing date and time of this recruitment. If applicable, a copy of your valid certification from Microsoft in database administration, obtained or renewed within the last five (5) years, if applicable. Supplemental Questionnaire Please Note: Resumes and attachments are not accepted in lieu of a completed employment application. Incomplete or inaccurate applications will be disqualified. Submission must be received by the closing date and time of this recruitment. Amendments will not be accepted after the filing deadline. Applications submitted via U.S. mail, email, fax, or in person in our office will not be accepted. SELECTION PROCESS Pursuant to Fresno County Personnel Rule 4 - Selection Process, applicants may be required to complete an examination process and successful candidates will be placed on an employment list effective for a minimum of 3 months and certified in final rank order as vacancies occur. Please Note: The eligible list for this recruitment may be extended up to 12 months and may be used to fill both extra-help and permanently allocated positions. Individuals selected for extra-help appointment may be transitioned to a permanently allocated position at a later date as authorized by the Fresno County Personnel Rules. REASONABLE ACCOMMODATIONS Positions in this classification are in Medical Group I - Light Physical Activity (Personnel Rule 8). This group includes positions which require only light physical effort and may include lifting of small, light objects and some bending, stooping, squatting, twisting, and reaching. Considerable walking or standing may be involved. The County of Fresno is committed to providing reasonable accommodation to applicants as required by the Americans with Disabilities Act (ADA) and the Fair Employment and Housing Act (FEHA). Qualified individuals with disabilities who need a reasonable accommodation during the application, examination or selection process may contact Human Resources at (559) 600-1830 at least five days prior to the scheduled date or deadline. Eligible candidates must be able to perform the essential functions of the position with or without reasonable accommodation. EQUAL EMPLOYMENT OPPORTUNITY EMPLOYER The County of Fresno is an Equal Employment Opportunity Employer. It is the policy of Fresno County to provide employment opportunity for all qualified persons. All applicants will be considered without regard to race, color, religion, sex, national origin, age, disability, sexual orientation, gender, gender identity, gender expression, marital status, ancestry, medical condition, genetic information, or denial of medical and family care leave, or any other non-job-related factor. Analyst: Jose Rubio",Government,https://www.indeed.com/cmp/Fresno-County,"1,001 to 5,000",$25M to $100M (USD),,,,,,California,"c, classification, mysql, sql"
