id,site,job_url,title,company,location,date_posted,job_type,salary_source,interval,min_amount,max_amount,currency,is_remote,job_level,job_function,listing_type,description,company_industry,company_url,company_num_employees,company_revenue,company_description,skills,experience_range,company_rating,company_reviews_count,state,parsed_skills
in-0a00aa7a3bc54231,indeed,https://www.indeed.com/viewjob?jk=0a00aa7a3bc54231,SQL DBA / Systems Analyst,"Contact Government Services, LLC","San Francisco, CA, US",2025-08-18,fulltime,direct_data,yearly,89301.0,114816.0,USD,False,,,,"SQL DBA / Systems Analyst Employment Type: Full Time, Mid-level Department: Information Technology CGS is seeking a SQL DBA / Systems Analyst to join our team supporting a wide-ranging technical support initiative for a large Federal agency. CGS brings motivated, highly skilled, and creative people together to solve the government's most dynamic problems with cutting-edge technology. To carry out our mission, we are seeking candidates who are excited to contribute to government innovation, appreciate collaboration, and can anticipate the needs of others. Here at CGS, we offer an environment in which our employees feel supported, and we encourage professional growth through various learning opportunities. Skills and attributes for success: Advanced processing of Electronic Stored Information (ESI) into multiple systems including hands-on file manipulations and conversions. Designing and implementing action plans to upgrade new litigation support tools within established environments by participating in Change Control Board Meetings. Leading user acceptance testing efforts and validating the rollout of new software upgrades; and integrating legal systems to improve efficiencies by creating scripts and advanced queries and introducing automated workflow concepts. Assists in administering database organizations, standards, controls, and procedures. Provides technical consulting in the definition, design, and creation of a database environment. Maintains documentation and develops database dictionaries. Qualifications: Undergraduate degree (or equivalent) with five years of professional experience, including four years performing tasks related to ESI Processing or upgrading and integrating technical systems. Knowledge of file manipulation applications, scripting, and the eDiscovery industry. Certification in an eDiscovery program or related software package (i.e., Concordance, Relativity, Clearwell). Must be willing to achieve Relativity Certified Administrator credential within 6 months of hire. Must have experience working within a network environment supporting an eDiscovery platform. Must have experience in Performing eDiscovery application system maintenance, upgrades, and day-to-day administration. Must have three years of experience designing, administering, maintaining, and updating databases. Must be familiar with government network operating environment standards and security requirements. Ideally, you will also have: 10+ years of experience supporting eDiscovery teams with SQL DBA requirements. Technical certifications or other pertinent graduate degrees preferred. Technology-assisted review experience is a plus. Our Commitment: Contact Government Services (CGS) strives to simplify and enhance government bureaucracy through the optimization of human, technical, and financial resources. We combine cutting-edge technology with world-class personnel to deliver customized solutions that fit our client's specific needs. We are committed to solving the most challenging and dynamic problems. For the past seven years, we've been growing our government-contracting portfolio, and along the way, we've created valuable partnerships by demonstrating a commitment to honesty, professionalism, and quality work. Here at CGS we value honesty through hard work and self-awareness, professionalism in all we do, and to deliver the best quality to our consumers mending those relations for years to come. We care about our employees. Therefore, we offer a comprehensive benefits package. Health, Dental, and Vision Life Insurance 401k Flexible Spending Account (Health, Dependent Care, and Commuter) Paid Time Off and Observance of State/Federal Holidays Contact Government Services, LLC is an Equal Opportunity Employer. Applicants will be considered without regard to their race, color, religion, sex, sexual orientation, gender identity, national origin, disability, or status as a protected veteran. Join our team and become part of government innovation! Explore additional job opportunities with CGS on our Job Board: https://cgsfederal.com/join-our-team/ For more information about CGS please visit: https://www.cgsfederal.com or contact: Email: info@cgsfederal.com #CJ We may use artificial intelligence (AI) tools to support parts of the hiring process, such as reviewing applications, analyzing resumes, or assessing responses. These tools assist our recruitment team but do not replace human judgment. Final hiring decisions are ultimately made by humans. If you would like more information about how your data is processed, please contact us.",nan,"https://www.indeed.com/cmp/Contact-Government-Services,-LLC",nan,nan,,,,,,California,sql
in-d953599905d631e6,indeed,https://www.indeed.com/viewjob?jk=d953599905d631e6,Database Administrator,University of California - San Francisco,"San Francisco, CA, US",2025-08-14,fulltime,direct_data,yearly,87900.0,145000.0,USD,False,,,,"**Candidates with strong Oracle skills highly encouraged to apply The Database Administrator will be an integral member of the Database Services team within the Platform Services domain. The Database Administrator will partner with diverse and talented team members to help solve multidimensional information technology problems, improve customer experience, and generate value for our campus stakeholders across a broad base of departments. The Database Administrator role involves supporting databases, including schema definition, structure, and long-range requirements, as well as facilitating the development of documentation, data security measures, and operational guidelines and protection. The Database Administrator assists the design, creation, optimization, and maintenance of IT databases. The Database Administrator partners with a broad range of customers, partners, and key stakeholders in academic, medical, and research organizations to provide best-in-class database services, profile application workloads, identify application and infrastructure interdependencies, and facilitate the seamless delivery of a secure database environment. The Database Administrator is accountable for implementing and maintaining stringent security protocols. This important task helps protect the University's data from unauthorized access and potential breaches. This role also serves as the first line of defense to diagnose and resolve issues when database problems arise, ensuring minimal disruption to the University's operations. The Database Administrator will positively impact UCSF's operations and culture by protecting University stakeholders' information and data in service of the institution's academic, medical, and research mission. This team member will advance the University's mission by delivering exceptional security service comprehensively and consistently across faculty, staff, and students. This role will execute UCSF's vision while modeling UCSF's culture and values. The final salary and offer components are subject to additional approvals based on UC policy. Your placement within the salary range is dependent on a number of factors including your work experience and internal equity within this position classification at UCSF. For positions that are represented by a labor union, placement within the salary range will be guided by the rules in the collective bargaining agreement. The salary range for this position is $87,900 - $145,000 (Annual Rate). To learn more about the benefits of working at UCSF, including total compensation, please visit: https://ucnet.universityofcalifornia.edu/compensation-and-benefits/index.html Department Description The Database Administrator will be an integral member of the Database Services team within the Platform Services domain. The Database Administrator will partner with diverse and talented team members to help solve multidimensional information technology problems, improve customer experience, and generate value for our campus stakeholders across a broad base of departments. The Database Administrator role involves supporting databases, including schema definition, structure, and long-range requirements, as well as facilitating the development of documentation, data security measures, and operational guidelines and protection. The Database Administrator assists the design, creation, optimization, and maintenance of IT databases. The Database Administrator partners with a broad range of customers, partners, and key stakeholders in academic, medical, and research organizations to provide best-in-class database services, profile application workloads, identify application and infrastructure interdependencies, and facilitate the seamless delivery of a secure database environment. The Database Administrator is accountable for implementing and maintaining stringent security protocols. This important task helps protect the University's data from unauthorized access and potential breaches. This role also serves as the first line of defense to diagnose and resolve issues when database problems arise, ensuring minimal disruption to the University's operations. The Database Administrator will positively impact UCSF's operations and culture by protecting University stakeholders' information and data in service of the institution's academic, medical, and research mission. This team member will advance the University's mission by delivering exceptional security service comprehensively and consistently across faculty, staff, and students. This role will execute UCSF's vision while modeling UCSF's culture and values. Required Qualifications Bachelor's degree, or equivalent combination of experience/training, in one or more of the following fields: computer science, engineering, computer information systems, etc. 1 to 3+ years of experience in information technology, database architecture, or software development. Prior experience in database technologies, customer experience services, or higher education. Demonstrated experience with database technologies and services. Provide experience in one or more of the following: Oracle, SQL, MySQL, Postgres SQL, or other. Experienced in data modeling and translation of the model into a high-performance physical database design. Fluent proficiency in SQL optimization. Experience with Linux/Unix and Windows system administration. Strong skills in PowerShell and/or Unix shell scripting. Experience with large design efforts working in cross-functional project teams. Strong written and verbal communication skills, with the ability to explain complex IT concepts to a non-technical audience. Strong customer service skills and ability to triage and escalate to leadership and management for resolution. Preferred Qualifications Certification: Database Administrator (Microsoft, Oracle, or equivalent) Demonstrated architecture experience creating a high-volume database for enterprise-grade solutions. Understanding of the attributes and processes of current application development methodologies. Knowledge of virtualization techniques and technologies to facilitate the development of highly scalable, multi-tenant SaaS offerings. Ability to interpret, analyze, and apply pertinent service level agreements, policies, procedures, regulations, and other requirements, and turn them into actionable outcomes. Expertise in database technologies on any of the following: Oracle MS SQL Server, MySQL, PostgreSQL, MongoDB, Access, and cloud database services. About UCSF The University of California, San Francisco (UCSF) is a leading university dedicated to promoting health worldwide through advanced biomedical research, graduate-level education in the life sciences and health professions, and excellence in patient care. It is the only campus in the 10-campus UC system dedicated exclusively to the health sciences. We bring together the world's leading experts in nearly every area of health. We are home to five Nobel laureates who have advanced the understanding of cancer, neurodegenerative diseases, aging and stem cells. Pride Values UCSF is a diverse community made of people with many skills and talents. We seek candidates whose work experience or community service has prepared them to contribute to our commitment to professionalism, respect, integrity, diversity and excellence &ndash; also known as our PRIDE values. In addition to our PRIDE values, UCSF is committed to equity &ndash; both in how we deliver care as well as our workforce. We are committed to building a broadly diverse community, nurturing a culture that is welcoming and supportive, and engaging diverse ideas for the provision of culturally competent education, discovery, and patient care. Additional information about UCSF is available at diversity.ucsf.edu Join us to find a rewarding career contributing to improving healthcare worldwide. Equal Employment Opportunity The University of California is an Equal Opportunity Employer. All qualified applicants will receive consideration for employment without regard to race, color, religion, sex, sexual orientation, gender identity, national origin, disability, age, protected veteran status, or other protected status under state or federal law. Organization Campus Job Code and Payroll Title 007177 DATABASE ADM 3 Job Category Clinical Systems / IT Professionals Bargaining Unit 99 - Policy-Covered (No Bargaining Unit) Employee Class Career Percentage 100% Location San Francisco, CA Campus Mission Center Building (SF) Work Style Flexible Shift Days, Evenings, Nights, Weekends Shift Length 8 Hours Additional Shift Details M-F, 8-hour shift. As required after hours, weekend, and escalation support",Education And Schools,https://www.indeed.com/cmp/University-of-California---SAN-Francisco,"10,000+",$25M to $100M (USD),,,,,,California,"classification, communication, data modeling, leadership, linux, mongodb, mysql, oracle, postgresql, powershell, shell scripting, sql, unix"
in-ad6881135f4adbcf,indeed,https://www.indeed.com/viewjob?jk=ad6881135f4adbcf,Database Marketing Manager-Enterprise Analytics,Sycuan Casino,"El Cajon, CA, US",2025-08-11,nan,nan,nan,,,nan,False,,,,"Posted Tuesday, August 12, 2025, 5:00 AM The ancestors of the Sycuan Band of the Kumeyaay Nation existed many centuries ago as a community of people&hellip;a Tribe living together, farming, hunting and fishing to survive. Much has changed since that time. Today the Sycuan Tribe governs its Reservation, owns and operates a Casino and a Golf Resort, and owns a number of other business ventures in the San Diego Region. One attribute that remains unchanged, however, is Sycuan's sense of community. Sycuan is more than just a business. Sycuan is a community of people working together toward a common goal. Whether you work in our state-of-the-art Casino, our beautiful Resort, or become a staff member in our Tribal Government division, you will be part of the Sycuan family. Sycuan Casino Resort is the premier gaming and hospitality destination in San Diego. We pride ourselves on delivering exceptional guest experiences through innovation, teamwork, and a commitment to excellence. Join our dynamic team and help shape the future of player engagement and loyalty. We are seeking a strategic and data-driven Database Marketing Manager to lead initiatives that grow and optimize our player database. This role is responsible for analyzing player behavior, segmenting audiences, and developing targeted marketing strategies to attract and retain guests. Job Purpose: The Database Marketing Manager oversees Sycuan Casino Resort's (SCR) initiatives to manage the player database, analyze behavior, and optimize to attract and retain high-value players. Job Duties and Responsibilities: (Note: Duties and responsibilities may be added, deleted, or changed at the sole discretion of Sycuan Management at any time) Database Segmentation Creates and manage strategies based on player behavior, lifecycle, demographics, and other factors to increase the size of the active marketable database Designs tailored marketing strategies for different database segments to enhance their gaming experience and satisfaction Identifies underperforming segments of the database and develops marketing strategies to address performance Manages external vendors to complete database append and/or hygiene, when necessary Implements data quality control measures to ensure data integrity and minimize errors Spearheads work with relevant departments to develop strategies to maximize database signups, improve player retention and conversion, reduce player churn, and increase recapture of lapsed guests Strategic Planning Develops and executes comprehensive direct marketing strategies to increase player retention and conversion, reduce churn, and increase recapture of lapsed guests Tracks and analyzes performance of marketing campaigns and identify areas of improvement Conducts testing to optimize reinvestment, offers, creative, and delivery methods Keeps abreast of competitor marketing programs and reinvestment strategies Collaboration and Communication Works with player development team to maximize strategies to increase player retention, reduce churn, increase reactivation of lapsed players Presents findings and insights to senior management and make recommendations for strategic adjustments Collaborates cross-functionally with various departments such as marketing, operations, finance, and IT to ensure cohesive strategies Communicates campaign information and performance to relevant stakeholders and team members Job Specifications: Education and Experience: Essential: Bachelor's Degree in Marketing, Computer Science, Economics, or related field or equivalent experience 5+ years database marketing &/or customer analytics or equivalent experience Experience in gaming and/or hospitality analytics Experience with casino management systems Direct experience deploying campaigns and expertise in best practices MBA or other graduate level degree preferred Skills and Knowledge: Essential: Advance proficiency in big-data analytics tools such as SQL, R, Python, Tableau, Excel, etc. Knowledge of database management best practices Excellent project management, prioritization, and communication skills Ability to analyze, compile and disseminate complex information in a clear and concise manner Ability to perform complex mathematical calculations Ability to read, analyze, interpret and make recommendations based on statistical reports Ability to maintain organization, meet deadlines, possess integrity, confidentiality, and discretion in handling confidential information Ability to identify trends, opportunities, or deficiencies and develop solutions to address Ability to make sound decisions and solve complex problems Ability to work in a fast-paced, demanding work environment Ability to effectively communicate and interact with team members, colleagues and business contacts Ability to conduct effective presentations to Senior Executive Staff Ability to maintain professionalism and composure in all situations Ability to accept constructive criticism Advanced proficiency in Microsoft Office, Word, PowerPoint, and Excel Ability to read, write, and communicate effectively in the English language Supervisory/Managerial Accountability: Direct: None Indirect: None Ready to make an impact? Apply today and help us elevate the Sycuan Casino Resort experience through strategic marketing and data excellence. Job Details Pay Type Salary",Restaurants Travel And Leisure,https://www.indeed.com/cmp/Sycuan-Casino,"1,001 to 5,000",$25M to $100M (USD),,,,,,California,"communication, excel, project management, python, r, sql, tableau"
in-b266d7184cf7bff2,indeed,https://www.indeed.com/viewjob?jk=b266d7184cf7bff2,Database Administrator,"Super Micro Computer, Inc.","San Jose, CA, US",2025-08-11,nan,direct_data,yearly,79000.0,131000.0,USD,False,,,,"Database Administrator Date: Nov 7, 2025 Location: San Jose, California, United States Company: Super Micro Computer Job Req ID: 27212 About Supermicro: Supermicro&reg; is a Top Tier provider of advanced server, storage, and networking solutions for Data Center, Cloud Computing, Enterprise IT, Hadoop/ Big Data, Hyperscale, HPC and IoT/Embedded customers worldwide. We are the #5 fastest growing company among the Silicon Valley Top 50 technology firms. Our unprecedented global expansion has provided us with the opportunity to offer a large number of new positions to the technology community. We seek talented, passionate, and committed engineers, technologists, and business leaders to join us. Job Summary: Supermicro Computer, Inc. is looking for a top tier Database Administrator in our headquarters located in San Jose, CA. Essential Duties and Responsibilities: Includes the following essential duties and responsibilities (other duties may also be assigned): Provide 24x7 production support for a large number of SOX-compliant database globally, ensuring prompt response to emergency situations and system outages. Monitor access logs, sensitive data update logs, and critical error logs to detect and respond promptly to unauthorized changes and security incidents. Ensure appropriate alerts are triggered for quick resolution. Ensure compliance with Segregation of Duties (SOD) standards and policies to safeguard sensitive production database data. Maintain the security and data integrity of production databases in strict adherence to SOX compliance standards. Implement and maintain robust high-availability architecture, disaster recovery, and backup solutions for mission-critical systems. Execute emergency response protocols, troubleshooting and resolving high-severity database incidents promptly to minimize service impact. Perform migrations and upgrades of large-scale existing databases to align with industry best practices and compliance requirements. Collaborate with Application and IT teams to design and optimize database environments for high performance and scalability. Proactively monitor and maintain all production databases, responding to SQL alerts and resolving issues. Perform advanced database administration, including automation of installation, configuration, patching, space management, and recovery procedures. Manage SQL Server AlwaysOn Availability Groups for high availability and fault tolerance. Conduct comprehensive database reviews and recommend improvement solutions to application owners. Provide technical documentation, operational procedures, operation status and analysis reports to IT management teams. Qualifications: Bachelor's degree with a minimum of 5 years of relevant experience, or equivalent combination of education and experience. Extensive knowledge of database internals, security, encryption, and performance optimization. Proficiency in T-SQL programming and complex query optimization. Experience with SQL Server installation, configuration, patching, migration, and HA/DR strategies. Strong understanding of MS SQL Server database technologies and architecture principles. Ability to provide 24x7 support for production environments, including emergency response for high-priority incidents. Experience with monitoring tools and proactive alert systems for access logs and error logs. Familiarity with SOX compliance standards and Segregation of Duties (SOD) policies. Experience with both on-premise and cloud environments. Strong problem-solving skills and the ability to work both independently and in team environments. Preferred Skills: Experience with MySQL, PostgresSQL is advantageous. Knowledge of SSRS, SSIS, and SSAS is a plus. Proficiency in SQL Server Extended Events, Profiler, T-SQL, PowerShell, and SQL migration strategies. Proficiency in PowerShell and SQL monitoring tools/solutions. Please note that this position requires regular in-office attendance. The successful candidate is expected to be present in the office during standard working hours as determined by the company. In-office collaboration and participation in team meetings, training sessions, and other on-site activities are essential aspects of this role. Candidates should consider the commuting distance and be prepared to fulfill their responsibilities in the designated office location. Salary Range $79,000 - $131,000 The salary offered will depend on several factors, including your location, level, education, training, specific skills, years of experience, and comparison to other employees already in this role. In addition to a comprehensive benefits package, candidates may be eligible for other forms of compensation, such as participation in bonus and equity award programs. EEO Statement Supermicro is an Equal Opportunity Employer and embraces diversity in our employee population. It is the policy of Supermicro to provide equal opportunity to all qualified applicants and employees without regard to race, color, religion, sex, sexual orientation, gender identity, national origin, age, disability, protected veteran status or special disabled veteran, marital status, pregnancy, genetic information, or any other legally protected status.",nan,"https://www.indeed.com/cmp/Super-Micro-Computer,-Inc.","1,001 to 5,000",$5M to $25M (USD),Supermicro is a Fortune 1000 company headquartered in the heart of Silicon Valley.,,,,,California,"mysql, powershell, scalability, sql"
