id,site,job_url,title,company,location,date_posted,job_type,salary_source,interval,min_amount,max_amount,currency,is_remote,job_level,job_function,listing_type,description,company_industry,company_url,company_num_employees,company_revenue,company_description,skills,experience_range,company_rating,company_reviews_count,state,parsed_skills
in-2ac4779c3b9d354f,indeed,https://www.indeed.com/viewjob?jk=2ac4779c3b9d354f,Financial Database Administrator - Disaster Management - Remote (US),ICF,"Austin, TX, US",2025-11-02,fulltime,direct_data,yearly,75000.0,137860.0,USD,True,,,,"Description Build a Rewarding Future at ICF! ICF's Disaster Management Division is looking a Financial Database Administrator &ndash; Disaster Management with experience in database administration to ensure secure, reliable, and high-performing data systems supporting disaster management and financial oversight. This position is 100% Remote United States with ability to travel . Preference given to Austin, Texas area, which would be a Hybrid job for that area. This position is experienced, non-supervisory, non-managerial level. As a Financial Database Administrator , you will play a critical role in ensuring our data infrastructure is secure, reliable, and high performing. You'll be responsible day one for installing and configuring database systems, managing user access and permissions to safeguard sensitive information, and implementing robust backup and recovery strategies to protect against data loss. Your expertise will drive ongoing performance tuning and optimization, ensuring our databases run efficiently and support business needs seamlessly. You'll maintain data integrity and accuracy, keep systems up to date with the latest patches and upgrades, and proactively troubleshoot any issues that arise. Additionally, you'll document configurations and procedures, contributing to a well-organized and resilient data environment that supports our organization's growth and success. You are a driven professional with deep experience in state and local government, specializing in federally funded disaster recovery and mitigation. Your current toolkit includes project management platforms, database creation and administration, financial reporting systems, and data analytics. You consistently deliver high-impact results aligned with ICF's values&mdash;ensuring quality, meeting deadlines, and improving processes. Proactive and self-reliant, you thrive in collaborative, inclusive teams and eagerly embrace new challenges to grow your skills and support client success. Compensation: While the range below is broader, this position will offer a base salary of 75K to 85K . Offer based on candidate's % of job description match and location. Compensation for this position is limited to this base salary range and the great full-time ICF benefits package for this level. No additional costs, fringe benefits, or compensation beyond what is outlined will be provided at this time. At ICF, you don't just support disaster recovery&mdash;you help communities rebuild stronger, smarter, and more resilient than ever. The Disaster Management Division offers the chance to work on high-impact, mission-driven projects alongside passionate experts, all while growing your career in a collaborative, values-driven environment. Key Responsibilities: Maintain and buildout functionality developed for clients in the Quickbase low-code platform. This includes monitoring and updating user permissions, building out additional modules to provide new functionality, updating data migration processes, and reconciling or QC'ing existing databanks. We manage a complex application that consolidates a web of databases into a single source for reporting. Ensuring the integrity of this database will be your primary responsibility. Support state and local governments to successfully administer grant programs by leveraging knowledge of their systems of records and maintaining an understanding of the internal challenges. Provide tailored guidance based on our knowledge of the various systems GLO interacts with to ensure the correct reports and tools are being provided. Develop and update job aid materials and SOPs to ensure consistency, while providing clear system navigation instructions. Ensure all documentations adhere to relevant federal and state laws, regulations, and CDBG-DR/MIT requirements, including checklists, procedural guides, process flowcharts, and training resources. Provide onsite technical assistance and training to state and local government agencies on programmatic systems and procedural requirements. Fulfill assigned responsibilities accurately and in a timely manner to ensure all tasks are completed by the designated due date, while proactively communicating any delays or knowledge gaps that may impact successful task completion. Deliver comprehensive financial system and data integrity support to promote accurate reporting within federal, state, and local government systems of record. Maintain a results-oriented approach to support the client in achieving audit readiness. Strong analytical skills with experience in reconciling complex financial data. Proficiency in Microsoft Excel functions (complex functions, Power Query, Pivot Tables). Ability to work independently, manage deadlines, and proactively address client needs and expectations. Collaborate with leads, peers, and the client to review, update and implement policies, procedures and best practices. Regularly participate and engage in management, strategy, and problem-solving meetings to effectively address client's needs and requirements. Please provide a well-written resume aligned to the qualifications, skills and experience required. Work examples may be requested as attachments and/or live demo. Minimum Required Qualifications: Bachelor's degree in management information systems, finance, accounting, or related field. 5+ years of experience in data analytics and reporting using common business intelligence tools, such as Power BI. 3+ years of recent experience in reporting, analytics, and financial database administration (*see above). 3+ years of hands-on experience writing technical guidance or procedures, examples SOP, functional specs. Advance knowledge of Microsoft Excel (including the use of pivot tables and self-creation of advanced formulas). Willing and able to travel (flight and vehicle) for work as needed with minimal notice. Preferred Skills/Experience: ( These may set candidates apart) Public Sector experience, such as state and local government working with federal grants. 3+ years of CDBG and/or CDBG-DR/MIT experience. Familiarity with HUDs DRGR Reporting system or Texas' TIGR reporting system Experience with data analysis, visualization, and manipulation using tools like Excel, Power BI, Python, Quickbase, Jet Reports, Tableau. Grant Accounting, Public Accounting, Budgeting Experience with Agile Methodology Experience with Microsoft Dynamics 365. Experience in delivering training and technical assistance. Experience with creation of CDBG-DR/MIT subject-related materials, such as training and technical assistance tools, presentations, handouts, etc. Experience working in Texas within a Federal, State and/or City financial role. Professional Skills: (You bring these skills with you day one) Highly detail-oriented and organized, with a strong understanding of federal, state and local government regulations. Collaborate effectively with teams such as program management, finance, business analysis and technical support. Demonstrate resourcefulness, strong analytical abilities and proficiency in conducting subject matter research to apply critical thinking skills. Strong written and verbal communication skills to identify system deficiencies, address data integrity issues, and offer solution-focused recommendations. Ability to execute project plans, maintain schedules, and forecast activities. Self-motivated with ability to work independently with attention to detail and strong time management. #indeed #LI-CC1 Working at ICF ICF is a global advisory and technology services provider, but we're not your typical consultants. We combine unmatched expertise with cutting-edge technology to help clients solve their most complex challenges, navigate change, and shape the future. We can only solve the world's toughest challenges by building a workplace that allows everyone to thrive. We are an equal opportunity employer. Together, our employees are empowered to share their expertise and collaborate with others to achieve personal and professional goals. For more information, please read our EEO policy. We will consider for employment qualified applicants with arrest and conviction records. Reasonable Accommodations are available, including, but not limited to, for disabled veterans, individuals with disabilities, and individuals with sincerely held religious beliefs, in all phases of the application and employment process. To request an accommodation, please email Candidateaccommodation@icf.com and we will be happy to assist. All information you provide will be kept confidential and will be used only to the extent required to provide needed reasonable accommodations. Read more about workplace discrimination rights or our benefit offerings which are included in the Transparency in (Benefits) Coverage Act. Candidate AI Usage Policy At ICF, we are committed to ensuring a fair interview process for all candidates based on their own skills and knowledge. As part of this commitment, the use of artificial intelligence (AI) tools to generate or assist with responses during interviews (whether in-person or virtual) is not permitted. This policy is in place to maintain the integrity and authenticity of the interview process. However, we understand that some candidates may require accommodation that involves the use of AI. If such an accommodation is needed, candidates are instructed to contact us in advance at candidateaccommodation@icf.com. We are dedicated to providing the necessary support to ensure that all candidates have an equal opportunity to succeed. Pay Range - There are multiple factors that are considered in determining final pay for a position, including, but not limited to, relevant work experience, skills, certifications and competencies that align to the specified role, geographic location, education and certifications as well as contract provisions regarding labor categories that are specific to the position. The pay range for this position based on full-time employment is: $81,094.00 - $137,860.00 Nationwide Remote Office (US99)",nan,https://www.indeed.com/cmp/Icf-4a7490b6,"5,001 to 10,000",$1B to $5B (USD),ICF is a global advisory and technology services provider. We combine unmatched expertise with cutting-edge technology to help clients solve their most complex challenges and shape the future.,,,,,Texas,"agile, communication, excel, power bi, project management, python, tableau"
in-23d0b472fd77921a,indeed,https://www.indeed.com/viewjob?jk=23d0b472fd77921a,Multiple Openings in IT and Business,Kairos Technologies,"Irving, TX, US",2025-10-30,nan,nan,nan,,,nan,False,,,,"Job Description Kairos Technologies in Irving, TX has multiple openings for IT & Bus. professionals to serve clients located throughout the U.S. in the following skill sets: Business Intelligence & Data Warehousing JO-010; System & Network Administration / Engineering JO-020; Quality Assurance / Performance Engineering JO-030; .net Development & Java development, JO-040; Salesforce.com Administration & Development, JO-050; & Database administration, JO-060. Positions require a B.S. in related field. Some require M.S. Some positions require relevant experience. Entry level positions are available with M.S. and no exp. Sr. level positions are also available. Positions require travel/relocation. Send resume to: hradmin@kairostech.com . Refer to Position Title for consideration. Applicants must have the authority to work permanently in the U.S. EO Statement: Kairos is an equal-opportunity employer. All qualified applicants have an equal opportunity for placement, and all employees have an equal opportunity to develop on the job. This means that Kairos will not discriminate against any employee or qualified applicant on the basis of race, color, religion, sex, sexual orientation, gender identity, national origin, disability or protected veteran status. Job Overview Location: Irving, TX Date Posted:",nan,https://www.indeed.com/cmp/Kairos-Technologies,nan,nan,,,,,,Texas,"data warehousing, java"
in-4b4f1c6a5fe4e27b,indeed,https://www.indeed.com/viewjob?jk=4b4f1c6a5fe4e27b,Senior Microsoft SQL Database Administrator,Gov Solutions Group,"San Antonio, TX, US",2025-10-30,nan,direct_data,yearly,141500.0,146500.0,USD,False,,,,"GovSG is seeking a skilled Microsoft SQL Database Administrator (DBA) to provide database management, optimization, and support for the NIWC Atlantic Defense Health Information Technology (DHIT) Division in support of the Defense Health Agency (DHA). The ideal candidate will play a key role in maintaining the integrity, performance, and security of SQL Server databases supporting mission-critical IT systems. This position involves close collaboration with functional end users, engineers, data analysts, developers, and system administrators to ensure reliable data availability and optimal performance for DHA enterprise applications. This is a hybrid position located in San Antonio, TX with 2-3 days per week on-site. Position Duties: Design, develop, and maintain SQL Server databases and stored procedures to support sensitive DHA data sets. Optimize complex queries, views, and data models to improve performance, accuracy, and scalability of analytical and operational systems. Support data integration and transformation processes using SSIS and related tools to enable reliable data flow across DHA systems. Ensure data integrity, availability, and security in compliance with DoW and DHA data management standards. Collaborate with data engineers, analysts, and system administrators to troubleshoot issues and implement enhancements. Develop and maintain technical documentation for database structures, processes, and data lineage. Participate in code reviews, performance testing, and continuous improvement of database development practices. Other duties as assigned Position Required: DoD Secret Clearance MUST BE A US CITIZEN to receive security clearance 5+ years of experience in Microsoft SQL Server development and database design within enterprise or government environments. Strong proficiency in T-SQL, including writing and optimizing complex queries, stored procedures, views, and functions. Experience with ETL processes and tools such as SSIS for data integration and transformation across large data sets. Familiarity with data modeling, schema design, and performance tuning for analytics and reporting. Understanding of DoW cybersecurity requirements, RMF, and DISA STIGs for database systems. Strong problem-solving and communication skills with experience collaborating in geographically dispersed cross-functional technical teams. Bachelor's degree in Computer Science, Information Systems, or related field. Salary: $141,500-$146,500. Actual compensation offer to candidate may vary from posted hiring range based upon geographic location, work experience, education, and/or skill level. The pay ratio between base pay and target incentive (if applicable) will be finalized at offer. Why You'll Want to Work at GovSG: Competitive pay and benefits, including PTO and company matched 401k Development opportunities through comprehensive training suite Ability to make an impact supporting the warfighter Opportunities to engage with the community through volunteering The above description reflects the details considered necessary to describe the principal functions of the job and should not be construed as a detailed description of all the work requirements that may be performed in the job. GovSG is an Equal Opportunity Employer, including Minorities/Females/Veterans/Disabled. All qualified applicants will receive consideration for employment without regard to race, color, religion, age, pregnancy, sex, sexual orientation, national origin, genetic information, physical or mental disability, military service, protected veteran status, or any other characteristic protected by applicable federal, state and local law. Know your Rights: If you would like more information, please visit www.eeoc.gov/poster. GovSG participates in E-Verify.",nan,https://www.indeed.com/cmp/Gov-Solutions-Group,51 to 200,nan,,,,,,Texas,"communication, data modeling, etl, scalability, sql"
in-49e28e212aa036bf,indeed,https://www.indeed.com/viewjob?jk=49e28e212aa036bf,SQL SERVER DBA,Viviente Software,"Floresville, TX, US",2025-10-29,nan,nan,nan,,,nan,False,,,,Are you passionate about data? Are you looking for a company to learn and grow with? EXPERIENCE OUR CULTURE We look forward to hearing from you. SQL SERVER DBA We are always looking for a good DBA! Our DBAs work on dynamic data projects that require frequent hands-on support and guidance. Skills Needed: Exceptional communication and organizational skills. Must be a certified SQL Server DBA.,nan,https://www.indeed.com/cmp/Viviente-Software,nan,nan,,,,,,Texas,"communication, sql"
in-6304329d001abe75,indeed,https://www.indeed.com/viewjob?jk=6304329d001abe75,Senior DBA 2 - DB2 Database Administrator SME,Capgemini,"TX, US",2025-10-28,fulltime,direct_data,yearly,66810.0,151510.0,USD,False,,,,"Job Title: Senior DBA 2 - DB2 Database Administrator SME Location: Dallas, TX Travel: 25% Job description: Title - DB2 Database Administrator SME contractor to be converted: Anoop N The DB2 Administrator is responsible for the installation and maintenance of database management systems (DBMS) such as DB2, SnowFlake, MySQL, SQL and Postgres servers. Perform database installation, configuration, and maintenance tasks. Monitor and optimize database performance, ensuring efficient operations. Performance and capacity tuning of system parameters and resources, utilizing various monitoring and reporting tools. Perform problem analysis and resolution, both technical and application-related Implement and maintain database security policies and procedures. Troubleshoot and resolve database-related issues on time. Collaborate with development teams to support database requirements for applications. Plan and execute database backup and recovery strategies. Stay updated on industry best practices and new features in DB2. Qualifications Hands-on experience as DBA in supporting applications using database DB2 products. Strong experience in Installation and configuration of Databases, Backup, restoring databases, setting up High Availability, Disaster recovery, performance tuning, RAC administration, regular Housekeeping, etc. Strong knowledge of database security principles and best practices. Ability to troubleshoot and resolve complex database issues. Excellent communication and collaboration skills. Relevant certifications (e.g., IBM Certified Database Administrator) are a plus. Life at Capgemini Capgemini supports all aspects of your well-being throughout the changing stages of your life and career. For eligible employees, we offer: Flexible work Healthcare including dental, vision, mental health, and well-being programs Financial well-being programs such as 401(k) and Employee Share Ownership Plan Paid time off and paid holidays Paid parental leave Family building benefits like adoption assistance, surrogacy, and cryopreservation Social well-being benefits like subsidized back-up child/elder care and tutoring Mentoring, coaching and learning programs Employee Resource Groups Disaster Relief About Capgemini Capgemini is a global business and technology transformation partner, helping organizations to accelerate their dual transition to a digital and sustainable world, while creating tangible impact for enterprises and society. It is a responsible and diverse group of 340,000 team members in more than 50 countries. With its strong over 55-year heritage, Capgemini is trusted by its clients to unlock the value of technology to address the entire breadth of their business needs. It delivers end-to-end services and solutions leveraging strengths from strategy and design to engineering, all fueled by its market leading capabilities in AI, generative AI, cloud and data, combined with its deep industry expertise and partner ecosystem. The Group reported 2024 global revenues of &euro;22.1 billion. Get the future you want | www.capgemini.com Disclaimer Capgemini is an Equal Opportunity Employer encouraging inclusion in the workplace. All qualified applicants will receive consideration for employment without regard to race, national origin, gender identity/expression, age, religion, disability, sexual orientation, genetics, veteran status, marital status or any other characteristic protected by law. This is a general description of the Duties, Responsibilities and Qualifications required for this position. Physical, mental, sensory or environmental demands may be referenced in an attempt to communicate the manner in which this position traditionally is performed. Whenever necessary to provide individuals with disabilities an equal employment opportunity, Capgemini will consider reasonable accommodations that might involve varying job requirements and/or changing the way this job is performed, provided that such accommodations do not pose an undue hardship. Capgemini is committed to providing reasonable accommodations during our recruitment process. If you need assistance or accommodation, please reach out to your recruiting contact. Please be aware that Capgemini may capture your image (video or screenshot) during the interview process and that image may be used for verification, including during the hiring and onboarding process. Click the following link for more information on your rights as an Applicant http://www.capgemini.com/resources/equal-employment-opportunity-is-the-law Applicants for employment in the US must have valid work authorization that does not now and/or will not in the future require sponsorship of a visa for employment authorization in the US by Capgemini. Capgemini discloses salary range information in compliance with state and local pay transparency obligations. The disclosed range represents the lowest to highest salary we, in good faith, believe we would pay for this role at the time of this posting, although we may ultimately pay more or less than the disclosed range, and the range may be modified in the future. The disclosed range takes into account the wide range of factors that are considered in making compensation decisions including, but not limited to, geographic location, relevant education, qualifications, certifications, experience, skills, seniority, performance, sales or revenue-based metrics, and business or organizational needs. At Capgemini, it is not typical for an individual to be hired at or near the top of the range for their role. The base salary range for the tagged location is $66,810 - $151,510. This role may be eligible for other compensation including variable compensation, bonus, or commission. Full time regular employees are eligible for paid time off, medical/dental/vision insurance, 401(k), and any other benefits to eligible employees. Note: No amount of pay is considered to be wages or compensation until such amount is earned, vested, and determinable. The amount and availability of any bonus, commission, or any other form of compensation that are allocable to a particular employee remains in the Company's sole discretion unless and until paid and may be modified at the Company's sole discretion, consistent with the law.",nan,https://www.indeed.com/cmp/Capgemini,"10,000+",more than $10B (USD),"With more than 325,000 people, Capgemini is present in over 50 countries and celebrated its 50th Anniversary year in 2017.",,,,,Texas,"communication, mysql, snowflake, sql"
