id,site,job_url,title,company,location,date_posted,job_type,salary_source,interval,min_amount,max_amount,currency,is_remote,job_level,job_function,listing_type,description,company_industry,company_url,company_num_employees,company_revenue,company_description,skills,experience_range,company_rating,company_reviews_count,state,parsed_skills
in-e4ff2711bb96e56f,indeed,https://www.indeed.com/viewjob?jk=e4ff2711bb96e56f,Lead Specialist - IT Oracle Database Administration,Energy Transfer,"Houston, TX, US",2025-07-29,fulltime,nan,nan,,,nan,False,,,,"Energy Transfer, recognized by Forbes as one of America's best large employers, is dedicated to responsibly and safely delivering America's energy. We are driven to inspire our employees to create superior value for our customers, our investors, a sustainable future and giving back to the community where we have long-standing commitments to causes including MD Anderson Children's Cancer Hospital, The Salvation Army, The American Red Cross, Ronald McDonald House and many more. We value all of our employees who make our growth and success possible. We are proud to offer industry leading compensation, comprehensive benefits, 401(k) match with additional profit sharing, PTO and abundant career opportunities. Come join our award winning 12,000 strong organization as we fuel the world and each other! Summary: Energy Transfer is seeking an Oracle Database Administrator with exceptionally strong experience, in designing/configuring/installing and end-user supporting Oracle Databases Systems on Exadata Appliances through thorough planning, monitoring, and proactive performance, security and Integrity Database Management. Essential Duties & Responsibilities: Install, patch, upgrade, maintain and monitor Oracle databases Create and maintain SQL and PL/SQL queries and shell scripts Monitor, and verify backups and perform ad-hoc backups Provide maintenance support for database systems Database performance tuning and troubleshooting Perform routine security and authentication measures Requirements : Education and/or Experience, Knowledge, Skills & Abilities: To perform this job successfully, an individual must be able to perform each essential duty satisfactorily. The requirements for this position are listed below: Minimum 2 years working with Oracle Autonomous Database Bachelor's degree or equivalent work experience Minimum 4 years working as Oracle Database Administrator in fast paced large environment. Minimum 4 years Oracle Database Performance Tuning of large systems. Minimum 4 years Oracle RAC-Full configuration and Performance Tuning. 4 years' experience working with Oracle VMs, Oracle OCI. 5 years and recent experience scripting jobs with tools like Ansible, Oracle Enterprise Manager Cloud Control. Minimum of 4 years configuring Oracle ASM setup. Have living experience with extreme process automation as lead contributor. Very strong Unix/Linux Scripting. Participate in 24 X 7 On-Call support rotation. Minimum of 4 years performing DB Encryptions. Smooth communicator, with strong documentation abilities. Self driven individual contributor, and very strong Team player for optimal collaboration. Requirement for position hold Certification for Oracle ADB Professional Certification Hold an OCI Foundations Associate Certification ""An equal opportunity employer/disability/vet The Partnership is an equal opportunity employer and does not discriminate against qualified applicants on the basis of any actual or perceived legally protected characteristics under federal, state, or local law. The nature and frequency of the above working conditions and requirements may vary depending on individual operational circumstances. Where feasible, the Partnership will make reasonable accommodations to qualified individuals with disabilities to enable them to perform the essential functions of the job. DISCLAIMER: The statements listed in this job posting, which are subject to change, are intended to describe the general nature and level of work being performed by people assigned to this job. They are not intended to be an exhaustive list of all responsibilities, duties and skills required of personnel so classified. """,nan,https://www.indeed.com/cmp/Energy-Transfer,"10,000+",more than $10B (USD),Energy Transfer is a Texas-based company that began in 1996 and is now one of the largest and most diversified investment grade master limited partnerships in the United States.,,,,,Texas,"ansible, linux, oracle, sql, unix"
in-1ea569369e8b4d8d,indeed,https://www.indeed.com/viewjob?jk=1ea569369e8b4d8d,ArcGIS Admin-5,Realign,"Houston, TX, US",2025-07-26,contract,nan,nan,,,nan,True,,,,"Job Type: Contract Job Category: IT Job Description Role &ndash; ArcGIS Admin Location &ndash; Houston, TX Contract &ndash; 3 Months 12+ Year Exp Mandatory skills: ArcGIS Enterprise Administration (Upgrade of software), Python, power shell scripting. Nice to have skill: Azure, Oil & Gas Key Responsibilities Develop and maintain web-based mapping applications using ArcGIS JavaScript API or other ArcGIS SDKs. Create, configure, and manage GIS services using ArcGIS Server and ArcGIS Online/Enterprise. Perform spatial data analysis and develop geoprocessing tools using Python (ArcPy) or ArcGIS Python API. Integrate GIS data with external systems via REST APIs and databases. Customize and extend ArcGIS tools using Python, JavaScript, or .NET. Work closely with analysts, engineers, and business users to gather requirements and deliver GIS solutions. Design and maintain spatial databases (e.g., PostgreSQL/PostGIS, SQL Server). Document solutions, workflows, and best practices. #ArcGISAdmin, #ArcGISAdministrator, #ArcGISEnterprise, #ArcGISServer, #GISAdmin, #GISJobs, #EsriAdmin, #PortalForArcGIS, #ArcGISOnline, #ArcPy, #PythonGIS, #EnterpriseGIS, #SDE, #SQLGIS, #GeospatialAdmin, #GISInfrastructure, #ArcGISSupport, #GISCareer, #MapServices, #ArcGISSecurity, #GISDeployment, #ArcGISMonitoring, #GISBackup, #PowerShellGIS, #ArcGISAutomation, #AdminGIS, #ArcGISCloud, #ArcGISRemote, #GISPerformance, #ArcGISLicensing, #ArcGISIndia, #ArcGISUpgrade, #GISMaintenance, #GISArchitecture, #GISProjects Required Skills DATABASE ADMINISTRATOR",nan,https://www.indeed.com/cmp/Realign,nan,nan,,,,,,Texas,"azure, javascript, postgresql, python, shell scripting, sql"
in-f1c78f26a940ad25,indeed,https://www.indeed.com/viewjob?jk=f1c78f26a940ad25,Database Administrator,LMR Technical Group,"JBSA Randolph, TX, US",2025-07-24,fulltime,nan,nan,,,nan,False,,,,"LMR Technical Group (LMR) is seeking Data Analysts to join our team. Location: Joint Base San Antonio, TX Job Description: As the CRAFT Database Administrator, you will manage enterprise data platforms that support high-performance tracking and outcomes. Ensure secure, accurate, and scalable systems to meet mission objectives. The DA is responsible for data governance, security, integration, classification, and accessibility across all CRAFT sites. The position works closely with administrators, managers, leads, and other stakeholders to ensure accurate secure, and user-friendly systems are in place for enterprise wide data capture, analysis, and reporting. Duties and Responsibilities: Administer database access, security, and system configurations. Monitor compliance with HIPAA, PII, and cybersecurity protocols. Collaborate with data analysts and programmers to improve data tools. Develop SOPs and train new users. Other related duties as assigned. Required Qualifications: 7+ years of experience in database administration. Understanding of disaster recovery and database backup procedures. Understanding of Government IT Certification and Accreditation Processes. Proficient understanding and working knowledge of computers, email, voicemail, and telephone texts to perform duties. Proficient with MS Word, Excel, and PowerPoint. Meet DoDM 8140.03 role 421 (Intermediate level) requirements. Proficient with MS Word, Excel, and PowerPoint. Current (or ability to obtain and maintain) Secret security clearance (T3 background investigation). Please visit the following link for more information: https://www.dcsa.mil/Personnel-Security/Background-Investigations-for-Applicants/Investigations-Clearance-Process/. U.S. citizenship is required to obtain a Secret clearance and work in this position. This job description is not designed to cover or contain a comprehensive listing of activities, duties or responsibilities that are required by this position. To perform this job successfully, an individual must be able to perform each essential duty satisfactorily. The requirements listed above are representative of the knowledge, skill, and/or ability required. Reasonable accommodations may be made to enable individuals with disabilities to perform the essential functions. Benefits Include: Medical, Dental, and Vision Insurance Life, AD&D, and Short-Term Disability Insurance 401(k) Paid Time Off Paid Holidays Employee Assistance Program Continuing Education Reimbursement Program About LMR: LMR is a service-disabled veteran-owned small business that supports technology development and provides comprehensive joint warfighter training by leveraging the skills, experience, and knowledge of its personnel. LMR Technical Group is an equal opportunity employer and does not discriminate on the basis of any legally protected status or characteristic. Protected veterans and individuals with disabilities are encouraged to apply. If you are a qualified applicant with a disability in need of an accommodation to complete the application process, please contact us at hr@lmrtec.com. EOE Disability/Veteran. EEOC Know Your Rights E-Verify Participation Poster Right to Work Poster Employee Polygraph Protection Act Poster FMLA Poster",nan,https://www.indeed.com/cmp/Lmr-Technical-Group,nan,nan,,,,,,Texas,"classification, excel"
in-5406cb3adce50569,indeed,https://www.indeed.com/viewjob?jk=5406cb3adce50569,Site Reliability Engineer (SRE) - SQL & NoSQL Database Operations,Kanrad Technologies,"Plano, TX, US",2025-07-21,fulltime,nan,nan,,,nan,False,,,,"Summary This role bridges software development and IT operations, focusing specifically on ensuring the reliability, scalability, and performance of our SQL and NoSQL database infrastructure. The SRE applies software engineering principles to automate database operations, build robust systems, and proactively address issues to minimize downtime and optimize resource utilization. Responsibilities Design and Implementation: Design, implement, and maintain scalable and reliable SQL and NoSQL database systems to support high-performance applications. Automation and Optimization: Develop automation using scripting languages (e.g., Python) and configuration management tools (e.g., Ansible, Terraform) to streamline database operations, deployments, and infrastructure management. Performance Tuning: Monitor, analyze, and optimize SQL queries and NoSQL database configurations (e.g., indexing, sharding, replication) to improve database performance and scalability. Monitoring and Alerting: Design, build, and maintain comprehensive database monitoring solutions to track key metrics (e.g., availability, latency, errors, saturation) and establish effective alerts. Incident Response: Participate in on-call rotations to respond to and resolve complex production issues and database-related incidents, conduct root cause analyses, and implement preventative measures. Infrastructure Modernization: Drive the modernization of existing database infrastructure through migrations, upgrades, and optimization efforts. Collaboration: Work closely with software developers, data engineers, DevOps teams, and architects to integrate database solutions into applications and optimize database performance and stability. Capacity Planning: Plan and manage database infrastructure capacity to support increasing data volumes and user traffic. Security: Implement database security policies, access controls, and encryption techniques to protect sensitive data. Backup and Recovery: Design and implement robust backup and recovery strategies to ensure data integrity and minimize downtime in case of failures. Skills & Requirements Database Expertise: Deep understanding and hands-on experience with both SQL (e.g., SQL Server, MySQL) and NoSQL databases (e.g., MongoDB, Redis). Software Engineering: Proficiency in programming languages like Python , c#, ReactJS, NodeJS etc and experience with software development best practices. Automation and Scripting: Expertise in automation tools (e.g., Ansible, Terraform) and scripting languages (e.g., Python, Bash) for database operations and infrastructure management. Cloud Platforms: Experience with cloud platforms (e.g., AWS, Azure, Google Cloud) and containerization technologies (e.g., Docker, Kubernetes). System Reliability Principles: Strong understanding of SRE principles and practices (e.g., SLIs, SLOs, error budgets, incident management). Problem-Solving: Excellent diagnostic and problem-solving skills with the ability to analyze complex systems and troubleshoot issues under pressure. Communication and Collaboration: Strong communication and collaboration skills to work effectively with cross-functional teams and stakeholders. Data Modeling and Design: Proficiency in data modeling and schema design for both relational and NoSQL databases. Performance Tuning: Ability to identify and resolve performance bottlenecks, optimize queries, and tune database configurations. This SRE role requires a blend of technical depth, a proactive mindset, and a commitment to continuous improvement to ensure the smooth operation and optimal performance of critical database systems. Qualifications Bachelor's degree in Computer Science, Information Technology, or a related field, or equivalent experience. Relevant certifications in database technologies or cloud platforms (a plus).",nan,https://www.indeed.com/cmp/Kanrad-Technologies,11 to 50,$1M to $5M (USD),,,,,,Texas,"ansible, aws, azure, bash, c, c#, communication, data modeling, docker, kubernetes, mongodb, mysql, python, redis, scalability, sql, terraform"
in-43873d4e5dad84f0,indeed,https://www.indeed.com/viewjob?jk=43873d4e5dad84f0,Senior SQL DBA,"Holley Performance Products, Inc.","New Braunfels, TX, US",2025-07-13,nan,nan,nan,,,nan,False,,,,"Overview At Holley, data is more than infrastructure, it's the engine that drives everything from production to performance. We're looking for a Senior SQL DBA with 7+ years of experience who knows how to tune, secure, and scale SQL Server environments that run real business. This isn't just about uptime, it's about impact. Our SQL Server instances run core business processes via complex scripts , stored procedures, and jobs. We need someone who lives in T-SQL , thrives under pressure, and can refactor and optimize code that others are scared to touch. If you're confident in your ability to own performance, handle fire drills, and design scalable database solutions and sustainable strategies , this role is built for you. Key Responsibilities SQL Scripting & Optimization Own and optimize the business-critical SQL scripts that power our core processes. Refactor complex stored procedures, improve indexing strategies, and reduce query latency across environments. Review execution plans and optimize database performance like a pro. Platform Stability & Performance Monitor and tune performance across development, test, and production environments. Design and maintain high availability and disaster recovery (HA/DR) strategies (Always On, Log Shipping, Replication, etc.). Execute schema changes, upgrades, and migrations with minimal risk and downtime. Security & Governance Implement data security protocols including role-based access, auditing, and encryption. Stay ahead of vulnerabilities, patches, and audit requirements. Collaborate with InfoSec and Compliance teams to meet organizational and regulatory standards. Cross-Team Collaboration Work with developers, analysts, and product teams to support SQL needs across applications and integrations. Provide expert support during deployments, cutovers, and production releases. Share knowledge and mentor others in SQL best practices and performance tuning. Documentation & Standards Maintain clear, comprehensive documentation for jobs, procedures, indexes, and backup strategies. Help enforce database development standards and governance policies. What You Bring 7+ years of hands-on SQL Server DBA experience in complex, high-volume environments. Deep expertise in T-SQL scripting and query optimization&mdash;you know the difference between a quick fix and a scalable solution. Proven success managing SQL Server 2016+ environments. Strong grasp of HA/DR technologies including Always On, Clustering, and Replication. Experience with PowerShell for scripting and automation. Working knowledge of security hardening, auditing, and compliance requirements. Outstanding troubleshooting skills&mdash;you're the calm in the SQL storm. Strong communicator who can work with both business and technical teams. Preferred Extras Experience with cloud-based SQL (Azure SQL, AWS RDS). Familiarity with SSIS, SSRS, or BI/reporting tools like Power BI or Tableau. Prior support of SaaS or third-party apps with SQL backends. Why Holley? Because here, the DBA isn't buried in a back room&mdash;you're at the core of performance, innovation, and stability. You'll own the heartbeat of the business , with the authority and support to make systems better, faster, and more resilient every day. Holley is an Equal Opportunity Employer committed to building a diverse and inclusive workforce. All qualified applicants will receive consideration for employment without regard to race, color, religion, sex, sexual orientation, gender identity, national origin, age, marital status, veteran status, disability, or any other legally protected status. If you require assistance or accommodation due to a disability during the application process, please contact human resources.",nan,"https://www.indeed.com/cmp/Holley-Performance-Products,-Inc.","501 to 1,000",$25M to $100M (USD),"At Holley we take our work seriously. We know that our job is to make automotive dreams come true. Whether we're engineering a product, manufacturing a product, taking it to market, or packing it and",,,,,Texas,"aws, azure, clustering, power bi, powershell, sql, tableau"
in-87444332637b48c6,indeed,https://www.indeed.com/viewjob?jk=87444332637b48c6,Senior E-Discovery Application Administrator II,"Contact Government Services, LLC","Austin, TX, US",2025-07-02,fulltime,direct_data,yearly,144768.0,209109.0,USD,False,,,,"Senior E-Discovery Application Administrator II Employment Type: Full-Time, Experienced Department: Legal Services CGS is seeking a dedicated worker with exceptional experience in the eDiscovery space to support a large federal agency. In this position, you will be providing full-time IT legal support services using various programs. As an expert programmer, you will be independently developing, modifying, and maintaining complex programs to support litigation environment applications, such as litigation support databases, associated management systems, and analytical systems. CGS brings motivated, highly skilled, and creative people together to solve the government's most dynamic problems with cutting-edge technology. To carry out our mission, we are seeking candidates who are excited to contribute to government innovation, appreciate collaboration, and can anticipate the needs of others. Here at CGS, we offer an environment in which our employees feel supported, and we encourage professional growth through various learning opportunities. Skills and attributes for success: Independently develop, modify, and maintain a complex program. Translate program requirements into program code. Test, debug, and refine programs to process data in accordance with written specifications. Revise programs to increase efficiency and reduce operating time. Develop data entry screens and other user interfaces and implements standardized reports, and create and generate specialized and ad hoc reports as required. Qualifications: Must be a United States Citizen Requires substantial, hands-on programming experience in the systems environment being used. At least two years of directly applicable experience is required. At least three years of overall programming experience will generally be expected, including experience with large-scale database management systems. Requires excellent oral and written communication skills. - Undergraduate degree strongly preferred - preferably in the computer science or information management/technology disciplines. Ideally, you will also have: Broad knowledge of the Government's IT environments, including office automation networks, and PC and server-based databases and applications. Supervisory or team leader experience Experience in automated litigation support Our commitment: Contact Government Services (CGS) strives to simplify and enhance government bureaucracy through the optimization of human, technical, and financial resources. We combine cutting-edge technology with world-class personnel to deliver customized solutions that fit our clients' specific needs. We are committed to solving the most challenging and dynamic problems. For the past seven years, we've been growing our government-contracting portfolio, and along the way, we've created valuable partnerships by demonstrating a commitment to honesty, professionalism, and quality work. Here at CGS we value honesty through hard work and self-awareness, professionalism in all we do, and to deliver the best quality to our consumers mending those relations for years to come. We care about our employees. Therefore, we offer a comprehensive benefits package: Health, Dental, and Vision Life Insurance 401k Flexible Spending Account (Health, Dependent Care, and Commuter) Paid Time Off and Observance of State/Federal Holidays Contact Government Services, LLC is an Equal Opportunity Employer. Applicants will be considered without regard to their race, color, religion, sex, sexual orientation, gender identity, national origin, disability, or status as a protected veteran. Join our team and become part of government innovation! Explore additional job opportunities with CGS on our Job Board: https://cgsfederal.com/join-our-team/ For more information about CGS please visit: https://www.cgsfederal.com or contact: Phone: +1 (888) 680-5916 Email: info@cgsfederal.com #CJ We may use artificial intelligence (AI) tools to support parts of the hiring process, such as reviewing applications, analyzing resumes, or assessing responses. These tools assist our recruitment team but do not replace human judgment. Final hiring decisions are ultimately made by humans. If you would like more information about how your data is processed, please contact us.",nan,"https://www.indeed.com/cmp/Contact-Government-Services,-LLC",nan,nan,,,,,,Texas,communication
