id,site,job_url,title,company,location,date_posted,job_type,salary_source,interval,min_amount,max_amount,currency,is_remote,job_level,job_function,listing_type,description,company_industry,company_url,company_num_employees,company_revenue,company_description,skills,experience_range,company_rating,company_reviews_count,state,parsed_skills
in-7d031c38dfae13e4,indeed,https://www.indeed.com/viewjob?jk=7d031c38dfae13e4,Database Engineer II (Onsite),Raytheon,"Richardson, TX, US",2025-11-28,fulltime,direct_data,yearly,66000.0,130000.0,USD,True,,,,"Date Posted: 2025-10-14 Country: United States of America Location: TX232: Richardson 1727 CityLine 1727 East CityLine Drive Building C27, Richardson, TX, 75082 USA Position Role Type: Onsite U.S. Citizen, U.S. Person, or Immigration Status Requirements: Active and transferable U.S. government issued security clearance is required prior to start date. U.S. citizenship is required, as only U.S. citizens are eligible for a security clearance Security Clearance: TS/SCI - Current At Raytheon, the foundation of everything we do is rooted in our values and a higher calling &ndash; to help our nation and allies defend freedoms and deter aggression. We bring the strength of more than 100 years of experience and renowned engineering expertise to meet the needs of today's mission and stay ahead of tomorrow's threat. Our team solves tough, meaningful problems that create a safer, more secure world. Raytheon is hiring a Database Engineer II to support our teams in Richardson TX . You will have the opportunity to directly impact the world around you and contribute to classified programs and technologies you are passionate about. In this position you would be familiar with creating, updating, and managing databases and the code that interacts with them. What You Will Do Identify and understand customer needs and apply sound, demonstrable understanding of database principles, theories, and concepts related to software engineering to translate those needs to viable design solutions. Demonstrate critical thinking skills with the ability to communicate concepts and ideas well. Successfully integrate Commercial Off-the-Shelf (COTS) products as part of customer-driven solutions. Use proven problem solving and analytical skills. Obtain and maintain SCI program access and complete polygraphs. Obtain Security+ certification within 60 days of start. Gain experience with Postgres and MongoDB. Qualifications You Must Have Typically requires a degree in Science, Technology, Engineering, or Mathematics (STEM) and a minimum of 2 years of Database Engineering experience. Experience with Database Administrator (DBA) duties. Experience with Relational Database Management Systems (RDBMS) solutions, such as Oracle. Experience working with Systems and Software. Experience using Linux command line to perform database administration activities. Active and transferable Top Secret U.S. government issued security clearance is required prior to start date with the ability to obtain a TS/SCI prior to start date. U.S. Citizenship is required as only U.S. Citizens are eligible for a clearance. Qualifications We Prefer Postgres and MongoDB experience strongly preferred. Existing Security+ Certification. Experience virtualizing or containerizing databases. Experience with AWS. Experience with NoSQL database products such as MongoDB and DynamoDB. Experience troubleshooting database issues such as DR, replication & backups and other related issues. Experience troubleshooting performance issues Experience with database security controls and audit & compliance requirements. Experience with automating routine tasks. Experience with Spatial databases Coding experience (SQL, Python, Java) is helpful! What We Offer Whether you're just starting out on your career journey or are an experienced professional, we offer a total rewards package that goes above and beyond with compensation; healthcare, wellness, retirement, and work/life benefits; career development and recognition programs. Some of the benefits we offer include parental (including paternal) leave, flexible work schedules, achievement awards, educational assistance, and child/adult backup care. Relocation Eligibility - Relocation assistance is available. Learn More & Apply Now! Please consider the following role type definition as you apply for this role. Onsite: Employees who are working in Onsite roles will work primarily onsite. This includes all production and maintenance employees, as they are essential to the development of our products. This position requires a security clearance. DCSA Consolidated Adjudication Services (DCSA), an agency of the Department of Defense, handles and adjudicates the security clearance process. More information about Security Clearances can be found on the US Department of State government website here: https://www.state.gov/m/ds/clearances/c10978.htm North Texas: https://careers.rtx.com/global/en/raytheon-north-texas-location We Are RTX #LI-Onsite #LI-HS30 As part of our commitment to maintaining a secure hiring process, candidates may be asked to attend select steps of the interview process in-person at one of our office locations, regardless of whether the role is designated as on-site, hybrid or remote. The salary range for this role is 66,000 USD - 130,000 USD. The salary range provided is a good faith estimate representative of all experience levels. RTX considers several factors when extending an offer, including but not limited to, the role, function and associated responsibilities, a candidate's work experience, location, education/training, and key skills. Hired applicants may be eligible for benefits, including but not limited to, medical, dental, vision, life insurance, short-term disability, long-term disability, 401(k) match, flexible spending accounts, flexible work schedules, employee assistance program, Employee Scholar Program, parental leave, paid time off, and holidays. Specific benefits are dependent upon the specific business unit as well as whether or not the position is covered by a collective-bargaining agreement. Hired applicants may be eligible for annual short-term and/or long-term incentive compensation programs depending on the level of the position and whether or not it is covered by a collective-bargaining agreement. Payments under these annual programs are not guaranteed and are dependent upon a variety of factors including, but not limited to, individual performance, business unit performance, and/or the company's performance. This role is a U.S.-based role. If the successful candidate resides in a U.S. territory, the appropriate pay structure and benefits will apply. RTX anticipates the application window closing approximately 40 days from the date the notice was posted. However, factors such as candidate flow and business necessity may require RTX to shorten or extend the application window. RTX is an Equal Opportunity Employer. All qualified applicants will receive consideration for employment without regard to race, color, religion, sex, sexual orientation, gender identity, national origin, age, disability or veteran status, or any other applicable state or federal protected class. RTX provides affirmative action in employment for qualified Individuals with a Disability and Protected Veterans in compliance with Section 503 of the Rehabilitation Act and the Vietnam Era Veterans' Readjustment Assistance Act. Privacy Policy and Terms: Click on this link to read the Policy and Terms",Aerospace And Defense,https://www.indeed.com/cmp/Raytheon,"10,000+",more than $10B (USD),"Raytheon, an RTX business, creates next-generation defense solutions that are smarter, faster and better than previously thought possible.",,,,,Texas,"aws, dynamodb, java, linux, mongodb, oracle, python, sql"
in-e4e2f06fbf8c96ba,indeed,https://www.indeed.com/viewjob?jk=e4e2f06fbf8c96ba,Database Administration Associate,Baylor College of Medicine,"Houston, TX, US",2025-11-26,fulltime,direct_data,yearly,99213.0,116721.0,USD,False,,,,"Summary We are seeking a database analyst and programmer to provide key data extraction, management, exploratory data analysis, and reporting services to research investigators working with healthcare administrative and electronic health record data. The ideal candidate will have database management experience and will be skilled in using SQL, SAS, and other statistical programming tools (e.g., R Stats). Essential to the role is a dedication to assessing and communicating the quality of data sources and iterative problem-solving in partnership with research investigators to arrive at optimal approaches to data preparation and analysis to answer essential research questions. Excellent verbal and written communication skills are essential to success in this role in collaborating with research teams. Current projects are related to Military Exposures among Veterans. This position is located within IQuESt, the Center for Innovation in Quality, Effectiveness, and Safety. We are the largest center for Health Services Research within the Southwest. We conduct high-quality scientific research that improves the health of patients across the nation, by helping to ensure the patient-centered delivery of scientific discoveries. Job Duties Designs, codes, tests, debugs, documents, and maintains programs that support answering a range of research questions. Execute data imports, exports, and data cleansing tasks for research project needs. Extracts, manages, and analyzes data in a cloud-computing environment (e.g., VA VINCI). Organizes and manipulates administrative healthcare data and electronic health record data to support answering health services research questions. Configures and customizes data management and statistical software for specific research project needs. Generates reports and data insights as needed for research team and stakeholders. Collaborates to identify and resolve data inconsistencies or errors. Assists research team in diagnosing and resolving database-related issues. Maintains documentation of database configurations, changes, and processes for research project. Documents issues and resolutions for future reference. Communicates with corporate data warehouse managers on behalf of the project team for data acquisition and troubleshooting. Prepares datasets in consultation with research statisticians and methodologists to support complex analyses. Supports team functioning by using shared project folders and sharing code with other analysts. Provides and documents thorough validation of data so that investigators can be confident that prepared datasets are appropriate for answering research questions. Demonstrates a commitment to quality and attention to detail. Attends and actively participates in project team meetings. Assists in monitoring database performance and availability. Performs routine database backups and recovery procedures. Helps ensure database security by supporting access controls and permissions. Assists in implementing database security measures to protect sensitive data. Monitors and analyzes database performance metrics. Provides recommendations for indexing, query optimization, and resource allocation. Designs and develops research databases (e.g., using MS Access, RedCap) for research participant recruiting and tracking and/or for research project data management. Serves as a technical resource for research investigators and research staff. Performs other job-related duties as assigned. Minimum Qualifications Bachelor's degree. Two years of relevant experience may substitute for degree requirement. Two years of relevant experience. Department-Specific Requirements SQL and R programming. Machine Learning and NLP. Preferred Qualifications and Skills Master's degree in Management Information Systems, Computer Science, Data Science, Statistics, Bioinformatics or a related field. At least 1 year experience in healthcare related research and/or experience in programming skills with SQL, SAS, or other programming tools (e.g. R, STATA). Excellent verbal and written communication are essential to success in this role on collaborative research teams. Work Authorization Requirement: This position is not eligible for visa sponsorship. Candidates must be legally authorized to work in the United States at the time of application and throughout the duration of employment. Baylor College of Medicine is an Equal Opportunity/Affirmative Action/Equal Access Employer.",Education And Schools,https://www.indeed.com/cmp/Baylor-College-of-Medicine,"5,001 to 10,000",$1B to $5B (USD),"Baylor College of Medicine is a health sciences university that creates knowledge and applies science and discoveries to further education, healthcare and community service locally and globally.",,,,,Texas,"communication, nlp, r, sas, sql, statistics"
in-982a720046e6e506,indeed,https://www.indeed.com/viewjob?jk=982a720046e6e506,Oracle Apps and DB Administrator,Infosys,"Greenville, TX, US",2025-11-25,fulltime,nan,nan,,,nan,False,,,,"Infosys is seeking an Oracle Apps and DB Administrator . This includes tasks like installing, maintaining and configuring databases, backup and recovery, DR, user management, patching, security configuration and providing technical support for releases and deployments. Additionally, proficiency in Scripting languages is required, along with automating tasks working on Linux OS and exposure to middleware technologies. The selected candidate should be able to support tickets, manage and / or open new Oracle Service Requests (SR's) as per customer requirements. The selected candidate will focus on Client SLA's, reduce downtime and may need to work in shifts while supporting tickets. Required Qualifications: At least 4 years of relevant Information Technology experience Bachelor's degree or foreign equivalent required from an accredited institution. Will also consider three years of progressive experience in the specialty in lieu of every year of education. Candidates must be located within commuting distance of Greenville, TX, Melbourne, FL or Salt Lake City, UT or be willing to relocate to one of these areas. Must be willing to travel for major milestones to client locations. In order to comply with legal requirements, this role is limited to ""U.S. persons"" as defined by 22 C.F.R. &sect;120.15. U.S. persons include U.S. citizens, U.S. Lawful Permanent Residents, and certain refugees and asylees. 2+ years of experience as EBS administration and monitoring EBS apps on Oracle database. Preferred Qualifications: Experience with Optimizing Queries and Database performance tuning. Experience developing, implementing and maintaining database security. Experience and desire to work closely with team members and Customer Along with competitive pay, as a full-time Infosys employee you are also eligible for the following benefits: Medical/Dental/Vision/Life Insurance Long-term/Short-term Disability Health and Dependent Care Reimbursement Accounts Insurance (Accident, Critical Illness, Hospital Indemnity, Legal) 401(k) plan and contributions dependent on salary level Paid holidays plus Paid Time Off The job entails sitting as well as working at a computer for extended periods of time. Should be able to communicate by telephone, email or face to face. Travel may be required as per the job requirements.",nan,https://www.indeed.com/cmp/Infosys,"10,000+",more than $10B (USD),,,,,,Texas,"linux, oracle"
in-4fb6162b8bc29857,indeed,https://www.indeed.com/viewjob?jk=4fb6162b8bc29857,Sr SQL Database Administrator – Kelsey Seybold Clinic,Kelsey-Seybold Clinic,"Pearland, TX, US",2025-11-24,fulltime,direct_data,yearly,89900.0,160600.0,USD,True,,,,"Job ID: 2317364 Job Type : Full-time Location : Pearland, TX 77581 Explore opportunities with Kelsey-Seybold Clinic, part of the Optum family of businesses. Work with one of the nation's leading health care organizations and build your career at one of our 40+ locations throughout Houston. Be part of a team that is nationally recognized for delivering coordinated and accountable care. As a multi-specialty clinic, we offer care from more than 900 medical providers in 65 medical specialties. Take on a rewarding opportunity to help drive higher quality, higher patient satisfaction and lower total costs. Join us and discover the meaning behind Caring. Connecting. Growing together. Works collaboratively as a senior member of the Business Intelligence & Reporting team under direction of KSC Application Technology Leadership. Supports, develops, and maintains SQL database environments and related technology. Acts as a team member on multi team projects and uses advanced skill set to develop, test, troubleshoot, and support database-related projects and associated solutions/applications. Acts as mentor to others learning essential and advanced SQL-related skills. If you are located in Texas, you will have the flexibility to work remotely* as you take on some tough challenges. Primary Responsibilities: Acts as a project lead or team member on multi-team projects. Uses advanced skill set to develop, test, and implement database/environment-related projects and applications. Participates in database-related planning, change control processes, upgrade, testing, and maintenance Provides general and specialized SQL database/environment-related support. Researches issues, contacts vendors, and uses specialized skills to aid in problem remediation Manages daily operations of assigned database systems and environments. Monitors and maintains uptime and performance data for related database servers, interfaces, and automated processes as required. Acts as mentor to others learning essential and advanced SQL-related skills Provides project management of assigned project components. Creates and maintains technical documentation as it relates to SQL database/environment and provides detailed reporting of all project activities to supervisor/manager Provides for level 3 support regarding all database issues. Other duties assigned You'll be rewarded and recognized for your performance in an environment that will challenge you and give you clear direction on what it takes to succeed in your role as well as provide development for other roles you may be interested in. Required Qualifications: Bachelor's degree in a technical area or equivalent work experience 6+ years of experience in SQL database administration Advanced technical competency in one or more of the following: MS SQL Server Administration Indexing strategies and maintenance Backup and recovery models Clustering and high availability Performance Tuning of Hardware & MS SQL Server MS SQL Transact SQL Programming (T-SQL) Server Monitoring Power shell scripting Database modeling / normalization MS SQL Data Transformation Services Services (SSIS) Administration MS SQL Server Analysis Services (SSAS) Administration MS SQL Server Reporting Services (SSRS) Administration Preferred Qualifications: Advanced degree SQL database-related work experience in a healthcare industry, large-scale data warehousing, and/or exposure to Epic Systems Clarity Advanced certification including: MCDBA MCTS MCITP Vendor Certified SQL Administrator Other database-related certification/s Flexibility and the ability to adapt to change Proven communication, presentation, analytical, problem solving, technical and writing skills. Candidates must have a positive ""can do"" attitude and a professional demeanor All employees working remotely will be required to adhere to UnitedHealth Group's Telecommuter Policy Pay is based on several factors including but not limited to local labor markets, education, work experience, certifications, etc. In addition to your salary, we offer benefits such as, a comprehensive benefits package, incentive and recognition programs, equity stock purchase and 401k contribution (all benefits are subject to eligibility requirements). No matter where or when you begin a career with us, you'll find a far-reaching choice of benefits and incentives. The salary for this role will range from $89,900 to $160,600 annually based on full-time employment. We comply with all minimum wage laws as applicable. At UnitedHealth Group, our mission is to help people live healthier lives and make the health system work better for everyone. We believe everyone-of every race, gender, sexuality, age, location and income-deserves the opportunity to live their healthiest life. Today, however, there are still far too many barriers to good health which are disproportionately experienced by people of color, historically marginalized groups and those with lower incomes. We are committed to mitigating our impact on the environment and enabling and delivering equitable care that addresses health disparities and improves health outcomes &ndash; an enterprise priority reflected in our mission. OptumCare is an Equal Employment Opportunity employer under applicable law and qualified applicants will receive consideration for employment without regard to race, national origin, religion, age, color, sex, sexual orientation, gender identity, disability, or protected veteran status, or any other characteristic protected by local, state, or federal laws, rules, or regulations. OptumCare is a drug-free workplace. Candidates are required to pass a drug test before beginning employment.",Health Care,https://www.indeed.com/cmp/Kelsey--seybold-Clinic,"1,001 to 5,000",$100M to $500M (USD),"Kelsey-Seybold Clinic is Houston's premier multispecialty group practice, founded in 1949 by Dr. Mavis Kelsey in Houston's renowned Texas Medical Center.",,,,,Texas,"clustering, communication, data warehousing, leadership, presentation, project management, shell scripting, sql"
